




arguments: F:\\code\\vscodecpp\\tshark\\build\\tshark.exe
Current dir: F:\code\vscodecpp\tshark\build
File verbosity level: 9
date       time         ( uptime  ) [ thread name/id ]                   file:line     v| 
2025-02-24 19:28:50.527 (   0.021s) [main thread     ]             loguru.cpp:851   INFO| Logging to 'log.txt', mode: 'a', verbosity: 9
2025-02-24 19:28:50.699 (   0.192s) [main thread     ]      tsharkManager.cpp:187   INFO| Packet Hex Data: 
2025-02-24 19:28:50.704 (   0.197s) [main thread     ]      tsharkManager.cpp:187   INFO| Packet Hex Data: 
2025-02-24 19:28:50.711 (   0.204s) [main thread     ]      tsharkManager.cpp:187   INFO| Packet Hex Data: 
2025-02-24 19:28:50.718 (   0.211s) [main thread     ]      tsharkManager.cpp:187   INFO| Packet Hex Data: 
2025-02-24 19:28:50.731 (   0.224s) [main thread     ]      tsharkManager.cpp:187   INFO| Packet Hex Data: 
2025-02-24 19:28:50.737 (   0.230s) [main thread     ]      tsharkManager.cpp:187   INFO| Packet Hex Data: 
2025-02-24 19:28:50.743 (   0.236s) [main thread     ]      tsharkManager.cpp:187   INFO| Packet Hex Data: 
2025-02-24 19:28:50.749 (   0.242s) [main thread     ]      tsharkManager.cpp:187   INFO| Packet Hex Data: 
2025-02-24 19:28:50.758 (   0.252s) [main thread     ]      tsharkManager.cpp:187   INFO| Packet Hex Data: 
2025-02-24 19:28:50.772 (   0.266s) [main thread     ]      tsharkManager.cpp:187   INFO| Packet Hex Data: 
2025-02-24 19:28:50.780 (   0.273s) [main thread     ]      tsharkManager.cpp:187   INFO| Packet Hex Data: 
2025-02-24 19:28:50.790 (   0.283s) [main thread     ]      tsharkManager.cpp:187   INFO| Packet Hex Data: 
2025-02-24 19:28:50.796 (   0.289s) [main thread     ]      tsharkManager.cpp:187   INFO| Packet Hex Data: 
2025-02-24 19:28:50.859 (   0.352s) [main thread     ]      tsharkManager.cpp:187   INFO| Packet Hex Data: 
2025-02-24 19:28:50.868 (   0.361s) [main thread     ]      tsharkManager.cpp:187   INFO| Packet Hex Data: 
2025-02-24 19:28:50.873 (   0.367s) [main thread     ]      tsharkManager.cpp:187   INFO| Packet Hex Data: 
2025-02-24 19:28:50.879 (   0.372s) [main thread     ]      tsharkManager.cpp:187   INFO| Packet Hex Data: 
2025-02-24 19:28:50.912 (   0.405s) [main thread     ]      tsharkManager.cpp:187   INFO| Packet Hex Data: 
2025-02-24 19:28:50.917 (   0.411s) [main thread     ]      tsharkManager.cpp:187   INFO| Packet Hex Data: 
2025-02-24 19:28:50.922 (   0.415s) [main thread     ]      tsharkManager.cpp:187   INFO| Packet Hex Data: 
2025-02-24 19:28:50.954 (   0.448s) [main thread     ]      tsharkManager.cpp:187   INFO| Packet Hex Data: 
2025-02-24 19:28:50.960 (   0.453s) [main thread     ]      tsharkManager.cpp:187   INFO| Packet Hex Data: 
2025-02-24 19:28:50.974 (   0.467s) [main thread     ]      tsharkManager.cpp:187   INFO| Packet Hex Data: 
2025-02-24 19:28:50.979 (   0.472s) [main thread     ]      tsharkManager.cpp:187   INFO| Packet Hex Data: 
2025-02-24 19:28:50.985 (   0.478s) [main thread     ]      tsharkManager.cpp:187   INFO| Packet Hex Data: 
2025-02-24 19:28:50.990 (   0.483s) [main thread     ]      tsharkManager.cpp:187   INFO| Packet Hex Data: 
2025-02-24 19:28:50.995 (   0.488s) [main thread     ]      tsharkManager.cpp:187   INFO| Packet Hex Data: 
2025-02-24 19:28:51.008 (   0.501s) [main thread     ]      tsharkManager.cpp:187   INFO| Packet Hex Data: 
2025-02-24 19:28:51.013 (   0.506s) [main thread     ]      tsharkManager.cpp:187   INFO| Packet Hex Data: 
2025-02-24 19:28:51.018 (   0.512s) [main thread     ]      tsharkManager.cpp:187   INFO| Packet Hex Data: 
2025-02-24 19:28:51.285 (   0.778s) [main thread     ]               main.cpp:13    INFO| ç½‘å¡[1]: name[(æœ¬åœ°è¿æ¥* 10)] remark[\Device\NPF_{EB190366-A5A6-4C8D-B4DF-355D1B90D1A9} (æœ¬åœ°è¿æ¥* 1]
2025-02-24 19:28:51.288 (   0.782s) [main thread     ]               main.cpp:13    INFO| ç½‘å¡[2]: name[(æœ¬åœ°è¿æ¥* 9)] remark[\Device\NPF_{0C363941-872F-49C3-B814-B6CA435D797E} (æœ¬åœ°è¿æ¥* ]
2025-02-24 19:28:51.293 (   0.786s) [main thread     ]               main.cpp:13    INFO| ç½‘å¡[3]: name[(æœ¬åœ°è¿æ¥* 8)] remark[\Device\NPF_{420B0E0D-BFD1-4945-86B0-E72AE7EA6823} (æœ¬åœ°è¿æ¥* ]
2025-02-24 19:28:51.297 (   0.790s) [main thread     ]               main.cpp:13    INFO| ç½‘å¡[5]: name[(WLAN)] remark[\Device\NPF_{AF966622-2F0D-43CD-9B76-BBAA9280F083} (WLA]
2025-02-24 19:28:51.300 (   0.793s) [main thread     ]               main.cpp:13    INFO| ç½‘å¡[8]: name[(æœ¬åœ°è¿æ¥* 2)] remark[\Device\NPF_{FAC028AB-BC2C-4A6E-A693-4A1B510F574E} (æœ¬åœ°è¿æ¥* ]
2025-02-24 19:28:51.303 (   0.797s) [main thread     ]               main.cpp:13    INFO| ç½‘å¡[9]: name[(æœ¬åœ°è¿æ¥* 1)] remark[\Device\NPF_{5775CBDE-76BC-413B-AE39-68E55E9BD8E9} (æœ¬åœ°è¿æ¥* ]
2025-02-24 19:28:51.308 (   0.801s) [main thread     ]               main.cpp:13    INFO| ç½‘å¡[10]: name[(Adapter for loopback traffic capture)] remark[\Device\NPF_Loopback (Adapter for loopback traffic captur]
2025-02-24 19:28:51.312 (   0.805s) [main thread     ]               main.cpp:13    INFO| ç½‘å¡[11]: name[(ä»¥å¤ªç½‘)] remark[\Device\NPF_{0887E5FB-0867-4A5F-ACB9-0BB5CD32D719} (ä»¥å¤ªç½]
2025-02-24 19:28:51.315 (   0.808s) [main thread     ]             loguru.cpp:548   INFO| atexit





arguments: F:\\code\\vscodecpp\\tshark\\build\\tshark.exe
Current dir: F:\code\vscodecpp\tshark\build
File verbosity level: 9
date       time         ( uptime  ) [ thread name/id ]                   file:line     v| 
2025-02-24 19:33:42.871 (   0.011s) [main thread     ]             loguru.cpp:851   INFO| Logging to 'log.txt', mode: 'a', verbosity: 9
2025-02-24 19:33:43.036 (   0.176s) [main thread     ]      tsharkManager.cpp:187   INFO| Packet Hex Data: 
2025-02-24 19:33:43.040 (   0.180s) [main thread     ]      tsharkManager.cpp:187   INFO| Packet Hex Data: 
2025-02-24 19:33:43.045 (   0.185s) [main thread     ]      tsharkManager.cpp:187   INFO| Packet Hex Data: 
2025-02-24 19:33:43.052 (   0.192s) [main thread     ]      tsharkManager.cpp:187   INFO| Packet Hex Data: 
2025-02-24 19:33:43.060 (   0.200s) [main thread     ]      tsharkManager.cpp:187   INFO| Packet Hex Data: 
2025-02-24 19:33:43.066 (   0.206s) [main thread     ]      tsharkManager.cpp:187   INFO| Packet Hex Data: 
2025-02-24 19:33:43.072 (   0.212s) [main thread     ]      tsharkManager.cpp:187   INFO| Packet Hex Data: 
2025-02-24 19:33:43.078 (   0.218s) [main thread     ]      tsharkManager.cpp:187   INFO| Packet Hex Data: 
2025-02-24 19:33:43.087 (   0.227s) [main thread     ]      tsharkManager.cpp:187   INFO| Packet Hex Data: 
2025-02-24 19:33:43.100 (   0.240s) [main thread     ]      tsharkManager.cpp:187   INFO| Packet Hex Data: 
2025-02-24 19:33:43.108 (   0.248s) [main thread     ]      tsharkManager.cpp:187   INFO| Packet Hex Data: 
2025-02-24 19:33:43.118 (   0.258s) [main thread     ]      tsharkManager.cpp:187   INFO| Packet Hex Data: 
2025-02-24 19:33:43.124 (   0.264s) [main thread     ]      tsharkManager.cpp:187   INFO| Packet Hex Data: 
2025-02-24 19:33:43.173 (   0.313s) [main thread     ]      tsharkManager.cpp:187   INFO| Packet Hex Data: 
2025-02-24 19:33:43.183 (   0.323s) [main thread     ]      tsharkManager.cpp:187   INFO| Packet Hex Data: 
2025-02-24 19:33:43.189 (   0.329s) [main thread     ]      tsharkManager.cpp:187   INFO| Packet Hex Data: 
2025-02-24 19:33:43.194 (   0.334s) [main thread     ]      tsharkManager.cpp:187   INFO| Packet Hex Data: 
2025-02-24 19:33:43.241 (   0.381s) [main thread     ]      tsharkManager.cpp:187   INFO| Packet Hex Data: 
2025-02-24 19:33:43.247 (   0.387s) [main thread     ]      tsharkManager.cpp:187   INFO| Packet Hex Data: 
2025-02-24 19:33:43.255 (   0.395s) [main thread     ]      tsharkManager.cpp:187   INFO| Packet Hex Data: 
2025-02-24 19:33:43.288 (   0.428s) [main thread     ]      tsharkManager.cpp:187   INFO| Packet Hex Data: 
2025-02-24 19:33:43.293 (   0.433s) [main thread     ]      tsharkManager.cpp:187   INFO| Packet Hex Data: 
2025-02-24 19:33:43.306 (   0.446s) [main thread     ]      tsharkManager.cpp:187   INFO| Packet Hex Data: 
2025-02-24 19:33:43.312 (   0.452s) [main thread     ]      tsharkManager.cpp:187   INFO| Packet Hex Data: 
2025-02-24 19:33:43.317 (   0.457s) [main thread     ]      tsharkManager.cpp:187   INFO| Packet Hex Data: 
2025-02-24 19:33:43.323 (   0.463s) [main thread     ]      tsharkManager.cpp:187   INFO| Packet Hex Data: 
2025-02-24 19:33:43.330 (   0.470s) [main thread     ]      tsharkManager.cpp:187   INFO| Packet Hex Data: 
2025-02-24 19:33:43.343 (   0.483s) [main thread     ]      tsharkManager.cpp:187   INFO| Packet Hex Data: 
2025-02-24 19:33:43.348 (   0.488s) [main thread     ]      tsharkManager.cpp:187   INFO| Packet Hex Data: 
2025-02-24 19:33:43.353 (   0.493s) [main thread     ]      tsharkManager.cpp:187   INFO| Packet Hex Data: 
2025-02-24 19:33:43.618 (   0.759s) [main thread     ]               main.cpp:13    INFO| ç½‘å¡[1]: name[æœ¬åœ°è¿æ¥* 10] remark[\Device\NPF_{EB190366-A5A6-4C8D-B4DF-355D1B90D1A9}]
2025-02-24 19:33:43.622 (   0.762s) [main thread     ]               main.cpp:13    INFO| ç½‘å¡[2]: name[æœ¬åœ°è¿æ¥* 9] remark[\Device\NPF_{0C363941-872F-49C3-B814-B6CA435D797E}]
2025-02-24 19:33:43.625 (   0.765s) [main thread     ]               main.cpp:13    INFO| ç½‘å¡[3]: name[æœ¬åœ°è¿æ¥* 8] remark[\Device\NPF_{420B0E0D-BFD1-4945-86B0-E72AE7EA6823}]
2025-02-24 19:33:43.628 (   0.768s) [main thread     ]               main.cpp:13    INFO| ç½‘å¡[5]: name[WLAN] remark[\Device\NPF_{AF966622-2F0D-43CD-9B76-BBAA9280F083}]
2025-02-24 19:33:43.632 (   0.772s) [main thread     ]               main.cpp:13    INFO| ç½‘å¡[8]: name[æœ¬åœ°è¿æ¥* 2] remark[\Device\NPF_{FAC028AB-BC2C-4A6E-A693-4A1B510F574E}]
2025-02-24 19:33:43.635 (   0.775s) [main thread     ]               main.cpp:13    INFO| ç½‘å¡[9]: name[æœ¬åœ°è¿æ¥* 1] remark[\Device\NPF_{5775CBDE-76BC-413B-AE39-68E55E9BD8E9}]
2025-02-24 19:33:43.639 (   0.779s) [main thread     ]               main.cpp:13    INFO| ç½‘å¡[10]: name[Adapter for loopback traffic capture] remark[\Device\NPF_Loopback]
2025-02-24 19:33:43.642 (   0.782s) [main thread     ]               main.cpp:13    INFO| ç½‘å¡[11]: name[ä»¥å¤ªç½‘] remark[\Device\NPF_{0887E5FB-0867-4A5F-ACB9-0BB5CD32D719}]
2025-02-24 19:33:43.645 (   0.785s) [main thread     ]             loguru.cpp:548   INFO| atexit





arguments: F:\\code\\vscodecpp\\tshark\\build\\tshark.exe
Current dir: F:\code\vscodecpp\tshark\build
File verbosity level: 9
date       time         ( uptime  ) [ thread name/id ]                   file:line     v| 
2025-02-24 19:39:19.814 (   0.012s) [main thread     ]             loguru.cpp:851   INFO| Logging to 'log.txt', mode: 'a', verbosity: 9
2025-02-24 19:39:19.983 (   0.182s) [main thread     ]      tsharkManager.cpp:181   INFO| {"frame_number":30,"timestamp":"2025-02-22 12:34:54.720979","src_mac":"30:89:4a:d4:25:ce","dst_mac":"b0:76:1b:21:30:ab","src_ip":"","src_location":"","src_port":0,"dst_ip":"","dst_location":"","dst_port":0,"protocol":"ARP","info":"10.199.217.176 is at 30:89:4a:d4:25:ce","file_offset":4953,"cap_len":42,"len":42}
2025-02-24 19:39:19.992 (   0.190s) [main thread     ]      tsharkManager.cpp:181   INFO| {"frame_number":13,"timestamp":"2025-02-22 12:34:53.526130","src_mac":"30:89:4a:d4:25:ce","dst_mac":"b0:76:1b:21:30:ab","src_ip":"10.199.217.176","src_location":"å†…ç½‘","src_port":80,"dst_ip":"123.56.161.176","dst_location":"ä¸­å›½-åŒ—äº¬-åŒ—äº¬å¸‚","dst_port":0,"protocol":"TCP","info":"36673 â†’ 80 [SYN] Seq=0 Win=65535 Len=0 MSS=1460 WS=256 SACK_PERM","file_offset":2261,"cap_len":66,"len":66}
2025-02-24 19:39:20.005 (   0.204s) [main thread     ]      tsharkManager.cpp:181   INFO| {"frame_number":12,"timestamp":"2025-02-22 12:34:53.501620","src_mac":"30:89:4a:d4:25:ce","dst_mac":"b0:76:1b:21:30:ab","src_ip":"10.199.217.176","src_location":"å†…ç½‘","src_port":80,"dst_ip":"123.56.161.176","dst_location":"ä¸­å›½-åŒ—äº¬-åŒ—äº¬å¸‚","dst_port":0,"protocol":"TCP","info":"36672 â†’ 80 [SYN] Seq=0 Win=65535 Len=0 MSS=1460 WS=256 SACK_PERM","file_offset":2179,"cap_len":66,"len":66}
2025-02-24 19:39:20.019 (   0.217s) [main thread     ]      tsharkManager.cpp:181   INFO| {"frame_number":11,"timestamp":"2025-02-22 12:34:53.497669","src_mac":"b0:76:1b:21:30:ab","dst_mac":"30:89:4a:d4:25:ce","src_ip":"114.114.114.114","src_location":"ä¸­å›½-æ±Ÿè‹çœ-å—äº¬å¸‚","src_port":56718,"dst_ip":"10.199.217.176","dst_location":"å†…ç½‘","dst_port":0,"protocol":"DNS","info":"Standard query response 0xba3d A api.pdfxd.com A 123.56.161.176","file_offset":2074,"cap_len":89,"len":89}
2025-02-24 19:39:20.032 (   0.230s) [main thread     ]      tsharkManager.cpp:181   INFO| {"frame_number":10,"timestamp":"2025-02-22 12:34:53.477857","src_mac":"30:89:4a:d4:25:ce","dst_mac":"b0:76:1b:21:30:ab","src_ip":"10.199.217.176","src_location":"å†…ç½‘","src_port":53,"dst_ip":"114.114.114.114","dst_location":"ä¸­å›½-æ±Ÿè‹çœ-å—äº¬å¸‚","dst_port":0,"protocol":"DNS","info":"Standard query 0xba3d A api.pdfxd.com","file_offset":1985,"cap_len":73,"len":73}
2025-02-24 19:39:20.045 (   0.244s) [main thread     ]      tsharkManager.cpp:181   INFO| {"frame_number":9,"timestamp":"2025-02-22 12:34:53.422618","src_mac":"b0:76:1b:21:30:ab","dst_mac":"30:89:4a:d4:25:ce","src_ip":"20.189.173.8","src_location":"ç¾å›½-åŠ åˆ©ç¦å°¼äºš-åœ£ä½•å¡","src_port":36641,"dst_ip":"10.199.217.176","dst_location":"å†…ç½‘","dst_port":0,"protocol":"TCP","info":"443 â†’ 36641 [ACK] Seq=100 Ack=972 Win=16381 Len=0","file_offset":1909,"cap_len":60,"len":60}
2025-02-24 19:39:20.058 (   0.256s) [main thread     ]      tsharkManager.cpp:181   INFO| {"frame_number":8,"timestamp":"2025-02-22 12:34:53.369397","src_mac":"30:89:4a:d4:25:ce","dst_mac":"b0:76:1b:21:30:ab","src_ip":"10.199.217.176","src_location":"å†…ç½‘","src_port":8080,"dst_ip":"157.148.54.28","dst_location":"ä¸­å›½-å¹¿ä¸œçœ-å¹¿å·å¸‚","dst_port":0,"protocol":"TCP","info":"56769 â†’ 8080 [ACK] Seq=154 Ack=81 Win=515 Len=0","file_offset":1839,"cap_len":54,"len":54}
2025-02-24 19:39:20.070 (   0.268s) [main thread     ]      tsharkManager.cpp:181   INFO| {"frame_number":7,"timestamp":"2025-02-22 12:34:53.322117","src_mac":"b0:76:1b:21:30:ab","dst_mac":"30:89:4a:d4:25:ce","src_ip":"157.148.54.28","src_location":"ä¸­å›½-å¹¿ä¸œçœ-å¹¿å·å¸‚","src_port":56769,"dst_ip":"10.199.217.176","dst_location":"å†…ç½‘","dst_port":0,"protocol":"TCP","info":"8080 â†’ 56769 [PSH, ACK] Seq=1 Ack=154 Win=4098 Len=80","file_offset":1689,"cap_len":134,"len":134}
2025-02-24 19:39:20.087 (   0.285s) [main thread     ]      tsharkManager.cpp:181   INFO| {"frame_number":6,"timestamp":"2025-02-22 12:34:53.274350","src_mac":"30:89:4a:d4:25:ce","dst_mac":"b0:76:1b:21:30:ab","src_ip":"10.199.217.176","src_location":"å†…ç½‘","src_port":8080,"dst_ip":"157.148.54.28","dst_location":"ä¸­å›½-å¹¿ä¸œçœ-å¹¿å·å¸‚","dst_port":0,"protocol":"TCP","info":"56769 â†’ 8080 [PSH, ACK] Seq=1 Ack=1 Win=515 Len=153","file_offset":1466,"cap_len":207,"len":207}
2025-02-24 19:39:20.110 (   0.308s) [main thread     ]      tsharkManager.cpp:181   INFO| {"frame_number":5,"timestamp":"2025-02-22 12:34:53.154173","src_mac":"30:89:4a:d4:25:ce","dst_mac":"b0:76:1b:21:30:ab","src_ip":"10.199.217.176","src_location":"å†…ç½‘","src_port":443,"dst_ip":"20.189.173.8","dst_location":"ç¾å›½-åŠ åˆ©ç¦å°¼äºš-åœ£ä½•å¡","dst_port":0,"protocol":"TLSv1.2","info":"Application Data","file_offset":1361,"cap_len":89,"len":89}
2025-02-24 19:39:20.122 (   0.320s) [main thread     ]      tsharkManager.cpp:181   INFO| {"frame_number":4,"timestamp":"2025-02-22 12:34:53.152758","src_mac":"b0:76:1b:21:30:ab","dst_mac":"30:89:4a:d4:25:ce","src_ip":"20.189.173.8","src_location":"ç¾å›½-åŠ åˆ©ç¦å°¼äºš-åœ£ä½•å¡","src_port":36641,"dst_ip":"10.199.217.176","dst_location":"å†…ç½‘","dst_port":0,"protocol":"TLSv1.2","info":"Application Data","file_offset":1192,"cap_len":153,"len":153}
2025-02-24 19:39:20.139 (   0.337s) [main thread     ]      tsharkManager.cpp:181   INFO| {"frame_number":3,"timestamp":"2025-02-22 12:34:53.152758","src_mac":"b0:76:1b:21:30:ab","dst_mac":"30:89:4a:d4:25:ce","src_ip":"20.189.173.8","src_location":"ç¾å›½-åŠ åˆ©ç¦å°¼äºš-åœ£ä½•å¡","src_port":36641,"dst_ip":"10.199.217.176","dst_location":"å†…ç½‘","dst_port":0,"protocol":"TCP","info":"443 â†’ 36641 [ACK] Seq=1 Ack=937 Win=16381 Len=0","file_offset":1116,"cap_len":60,"len":60}
2025-02-24 19:39:20.150 (   0.349s) [main thread     ]      tsharkManager.cpp:181   INFO| {"frame_number":2,"timestamp":"2025-02-22 12:34:52.899472","src_mac":"30:89:4a:d4:25:ce","dst_mac":"b0:76:1b:21:30:ab","src_ip":"10.199.217.176","src_location":"å†…ç½‘","src_port":443,"dst_ip":"20.189.173.8","dst_location":"ç¾å›½-åŠ åˆ©ç¦å°¼äºš-åœ£ä½•å¡","dst_port":0,"protocol":"TLSv1.2","info":"Application Data","file_offset":194,"cap_len":906,"len":906}
2025-02-24 19:39:20.205 (   0.403s) [main thread     ]      tsharkManager.cpp:181   INFO| {"frame_number":1,"timestamp":"2025-02-22 12:34:52.899381","src_mac":"30:89:4a:d4:25:ce","dst_mac":"b0:76:1b:21:30:ab","src_ip":"10.199.217.176","src_location":"å†…ç½‘","src_port":443,"dst_ip":"20.189.173.8","dst_location":"ç¾å›½-åŠ åˆ©ç¦å°¼äºš-åœ£ä½•å¡","dst_port":0,"protocol":"TLSv1.2","info":"Application Data","file_offset":40,"cap_len":138,"len":138}
2025-02-24 19:39:20.220 (   0.419s) [main thread     ]      tsharkManager.cpp:181   INFO| {"frame_number":14,"timestamp":"2025-02-22 12:34:53.530627","src_mac":"b0:76:1b:21:30:ab","dst_mac":"30:89:4a:d4:25:ce","src_ip":"123.56.161.176","src_location":"ä¸­å›½-åŒ—äº¬-åŒ—äº¬å¸‚","src_port":36672,"dst_ip":"10.199.217.176","dst_location":"å†…ç½‘","dst_port":0,"protocol":"TCP","info":"80 â†’ 36672 [SYN, ACK] Seq=0 Ack=1 Win=29200 Len=0 MSS=1440 SACK_PERM WS=512","file_offset":2343,"cap_len":66,"len":66}
2025-02-24 19:39:20.234 (   0.432s) [main thread     ]      tsharkManager.cpp:181   INFO| {"frame_number":15,"timestamp":"2025-02-22 12:34:53.530716","src_mac":"30:89:4a:d4:25:ce","dst_mac":"b0:76:1b:21:30:ab","src_ip":"10.199.217.176","src_location":"å†…ç½‘","src_port":80,"dst_ip":"123.56.161.176","dst_location":"ä¸­å›½-åŒ—äº¬-åŒ—äº¬å¸‚","dst_port":0,"protocol":"TCP","info":"36672 â†’ 80 [ACK] Seq=1 Ack=1 Win=262144 Len=0","file_offset":2425,"cap_len":54,"len":54}
2025-02-24 19:39:20.245 (   0.443s) [main thread     ]      tsharkManager.cpp:181   INFO| {"frame_number":16,"timestamp":"2025-02-22 12:34:53.530822","src_mac":"30:89:4a:d4:25:ce","dst_mac":"b0:76:1b:21:30:ab","src_ip":"10.199.217.176","src_location":"å†…ç½‘","src_port":80,"dst_ip":"123.56.161.176","dst_location":"ä¸­å›½-åŒ—äº¬-åŒ—äº¬å¸‚","dst_port":0,"protocol":"HTTP/JSON","info":"POST /pdf-service/v1/report HTTP/1.1 , JSON (application/json)","file_offset":2495,"cap_len":619,"len":619}
2025-02-24 19:39:20.284 (   0.483s) [main thread     ]      tsharkManager.cpp:181   INFO| {"frame_number":17,"timestamp":"2025-02-22 12:34:53.554641","src_mac":"b0:76:1b:21:30:ab","dst_mac":"30:89:4a:d4:25:ce","src_ip":"123.56.161.176","src_location":"ä¸­å›½-åŒ—äº¬-åŒ—äº¬å¸‚","src_port":36673,"dst_ip":"10.199.217.176","dst_location":"å†…ç½‘","dst_port":0,"protocol":"TCP","info":"80 â†’ 36673 [SYN, ACK] Seq=0 Ack=1 Win=29200 Len=0 MSS=1440 SACK_PERM WS=512","file_offset":3130,"cap_len":66,"len":66}
2025-02-24 19:39:20.296 (   0.495s) [main thread     ]      tsharkManager.cpp:181   INFO| {"frame_number":18,"timestamp":"2025-02-22 12:34:53.554723","src_mac":"30:89:4a:d4:25:ce","dst_mac":"b0:76:1b:21:30:ab","src_ip":"10.199.217.176","src_location":"å†…ç½‘","src_port":80,"dst_ip":"123.56.161.176","dst_location":"ä¸­å›½-åŒ—äº¬-åŒ—äº¬å¸‚","dst_port":0,"protocol":"TCP","info":"36673 â†’ 80 [ACK] Seq=1 Ack=1 Win=262144 Len=0","file_offset":3212,"cap_len":54,"len":54}
2025-02-24 19:39:20.307 (   0.505s) [main thread     ]      tsharkManager.cpp:181   INFO| {"frame_number":19,"timestamp":"2025-02-22 12:34:53.554904","src_mac":"30:89:4a:d4:25:ce","dst_mac":"b0:76:1b:21:30:ab","src_ip":"10.199.217.176","src_location":"å†…ç½‘","src_port":80,"dst_ip":"123.56.161.176","dst_location":"ä¸­å›½-åŒ—äº¬-åŒ—äº¬å¸‚","dst_port":0,"protocol":"HTTP/JSON","info":"POST /pdf-service/v1/report HTTP/1.1 , JSON (application/json)","file_offset":3282,"cap_len":613,"len":613}
2025-02-24 19:39:20.347 (   0.545s) [main thread     ]      tsharkManager.cpp:181   INFO| {"frame_number":20,"timestamp":"2025-02-22 12:34:53.556484","src_mac":"b0:76:1b:21:30:ab","dst_mac":"30:89:4a:d4:25:ce","src_ip":"123.56.161.176","src_location":"ä¸­å›½-åŒ—äº¬-åŒ—äº¬å¸‚","src_port":36672,"dst_ip":"10.199.217.176","dst_location":"å†…ç½‘","dst_port":0,"protocol":"TCP","info":"80 â†’ 36672 [ACK] Seq=1 Ack=566 Win=30720 Len=0","file_offset":3911,"cap_len":60,"len":60}
2025-02-24 19:39:20.357 (   0.556s) [main thread     ]      tsharkManager.cpp:181   INFO| {"frame_number":21,"timestamp":"2025-02-22 12:34:53.561487","src_mac":"b0:76:1b:21:30:ab","dst_mac":"30:89:4a:d4:25:ce","src_ip":"123.56.161.176","src_location":"ä¸­å›½-åŒ—äº¬-åŒ—äº¬å¸‚","src_port":36672,"dst_ip":"10.199.217.176","dst_location":"å†…ç½‘","dst_port":0,"protocol":"HTTP/JSON","info":"HTTP/1.1 200 OK , JSON (application/json)","file_offset":3987,"cap_len":215,"len":215}
2025-02-24 19:39:20.376 (   0.575s) [main thread     ]      tsharkManager.cpp:181   INFO| {"frame_number":22,"timestamp":"2025-02-22 12:34:53.561554","src_mac":"30:89:4a:d4:25:ce","dst_mac":"b0:76:1b:21:30:ab","src_ip":"10.199.217.176","src_location":"å†…ç½‘","src_port":80,"dst_ip":"123.56.161.176","dst_location":"ä¸­å›½-åŒ—äº¬-åŒ—äº¬å¸‚","dst_port":0,"protocol":"TCP","info":"36672 â†’ 80 [ACK] Seq=566 Ack=162 Win=261888 Len=0","file_offset":4218,"cap_len":54,"len":54}
2025-02-24 19:39:20.389 (   0.587s) [main thread     ]      tsharkManager.cpp:181   INFO| {"frame_number":23,"timestamp":"2025-02-22 12:34:53.564882","src_mac":"30:89:4a:d4:25:ce","dst_mac":"b0:76:1b:21:30:ab","src_ip":"10.199.217.176","src_location":"å†…ç½‘","src_port":80,"dst_ip":"123.56.161.176","dst_location":"ä¸­å›½-åŒ—äº¬-åŒ—äº¬å¸‚","dst_port":0,"protocol":"TCP","info":"36672 â†’ 80 [RST, ACK] Seq=566 Ack=162 Win=0 Len=0","file_offset":4288,"cap_len":54,"len":54}
2025-02-24 19:39:20.399 (   0.597s) [main thread     ]      tsharkManager.cpp:181   INFO| {"frame_number":24,"timestamp":"2025-02-22 12:34:53.592374","src_mac":"b0:76:1b:21:30:ab","dst_mac":"30:89:4a:d4:25:ce","src_ip":"123.56.161.176","src_location":"ä¸­å›½-åŒ—äº¬-åŒ—äº¬å¸‚","src_port":36672,"dst_ip":"10.199.217.176","dst_location":"å†…ç½‘","dst_port":0,"protocol":"TCP","info":"80 â†’ 36672 [RST] Seq=162 Win=0 Len=0","file_offset":4358,"cap_len":60,"len":60}
2025-02-24 19:39:20.411 (   0.609s) [main thread     ]      tsharkManager.cpp:181   INFO| {"frame_number":25,"timestamp":"2025-02-22 12:34:53.594427","src_mac":"b0:76:1b:21:30:ab","dst_mac":"30:89:4a:d4:25:ce","src_ip":"123.56.161.176","src_location":"ä¸­å›½-åŒ—äº¬-åŒ—äº¬å¸‚","src_port":36673,"dst_ip":"10.199.217.176","dst_location":"å†…ç½‘","dst_port":0,"protocol":"TCP","info":"80 â†’ 36673 [ACK] Seq=1 Ack=560 Win=30720 Len=0","file_offset":4434,"cap_len":60,"len":60}
2025-02-24 19:39:20.421 (   0.620s) [main thread     ]      tsharkManager.cpp:181   INFO| {"frame_number":26,"timestamp":"2025-02-22 12:34:53.599127","src_mac":"b0:76:1b:21:30:ab","dst_mac":"30:89:4a:d4:25:ce","src_ip":"123.56.161.176","src_location":"ä¸­å›½-åŒ—äº¬-åŒ—äº¬å¸‚","src_port":36673,"dst_ip":"10.199.217.176","dst_location":"å†…ç½‘","dst_port":0,"protocol":"HTTP/JSON","info":"HTTP/1.1 200 OK , JSON (application/json)","file_offset":4510,"cap_len":215,"len":215}
2025-02-24 19:39:20.440 (   0.638s) [main thread     ]      tsharkManager.cpp:181   INFO| {"frame_number":27,"timestamp":"2025-02-22 12:34:53.599172","src_mac":"30:89:4a:d4:25:ce","dst_mac":"b0:76:1b:21:30:ab","src_ip":"10.199.217.176","src_location":"å†…ç½‘","src_port":80,"dst_ip":"123.56.161.176","dst_location":"ä¸­å›½-åŒ—äº¬-åŒ—äº¬å¸‚","dst_port":0,"protocol":"TCP","info":"36673 â†’ 80 [ACK] Seq=560 Ack=162 Win=261888 Len=0","file_offset":4741,"cap_len":54,"len":54}
2025-02-24 19:39:20.450 (   0.648s) [main thread     ]      tsharkManager.cpp:181   INFO| {"frame_number":28,"timestamp":"2025-02-22 12:34:53.605450","src_mac":"30:89:4a:d4:25:ce","dst_mac":"b0:76:1b:21:30:ab","src_ip":"10.199.217.176","src_location":"å†…ç½‘","src_port":80,"dst_ip":"123.56.161.176","dst_location":"ä¸­å›½-åŒ—äº¬-åŒ—äº¬å¸‚","dst_port":0,"protocol":"TCP","info":"36673 â†’ 80 [RST, ACK] Seq=560 Ack=162 Win=0 Len=0","file_offset":4811,"cap_len":54,"len":54}
2025-02-24 19:39:20.460 (   0.658s) [main thread     ]      tsharkManager.cpp:181   INFO| {"frame_number":29,"timestamp":"2025-02-22 12:34:54.720955","src_mac":"b0:76:1b:21:30:ab","dst_mac":"30:89:4a:d4:25:ce","src_ip":"","src_location":"","src_port":0,"dst_ip":"","dst_location":"","dst_port":0,"protocol":"ARP","info":"Who has 10.199.217.176? Tell 10.199.255.254","file_offset":4881,"cap_len":56,"len":56}
2025-02-24 19:39:20.470 (   0.668s) [main thread     ]      tsharkManager.cpp:194   INFO| 30 packets have been printed.
2025-02-24 19:39:20.739 (   0.938s) [main thread     ]               main.cpp:13    INFO| ç½‘å¡[1]: name[æœ¬åœ°è¿æ¥* 10] remark[\Device\NPF_{EB190366-A5A6-4C8D-B4DF-355D1B90D1A9}]
2025-02-24 19:39:20.743 (   0.941s) [main thread     ]               main.cpp:13    INFO| ç½‘å¡[2]: name[æœ¬åœ°è¿æ¥* 9] remark[\Device\NPF_{0C363941-872F-49C3-B814-B6CA435D797E}]
2025-02-24 19:39:20.746 (   0.944s) [main thread     ]               main.cpp:13    INFO| ç½‘å¡[3]: name[æœ¬åœ°è¿æ¥* 8] remark[\Device\NPF_{420B0E0D-BFD1-4945-86B0-E72AE7EA6823}]
2025-02-24 19:39:20.749 (   0.948s) [main thread     ]               main.cpp:13    INFO| ç½‘å¡[5]: name[WLAN] remark[\Device\NPF_{AF966622-2F0D-43CD-9B76-BBAA9280F083}]
2025-02-24 19:39:20.753 (   0.951s) [main thread     ]               main.cpp:13    INFO| ç½‘å¡[8]: name[æœ¬åœ°è¿æ¥* 2] remark[\Device\NPF_{FAC028AB-BC2C-4A6E-A693-4A1B510F574E}]
2025-02-24 19:39:20.757 (   0.955s) [main thread     ]               main.cpp:13    INFO| ç½‘å¡[9]: name[æœ¬åœ°è¿æ¥* 1] remark[\Device\NPF_{5775CBDE-76BC-413B-AE39-68E55E9BD8E9}]
2025-02-24 19:39:20.760 (   0.958s) [main thread     ]               main.cpp:13    INFO| ç½‘å¡[10]: name[Adapter for loopback traffic capture] remark[\Device\NPF_Loopback]
2025-02-24 19:39:20.763 (   0.961s) [main thread     ]               main.cpp:13    INFO| ç½‘å¡[11]: name[ä»¥å¤ªç½‘] remark[\Device\NPF_{0887E5FB-0867-4A5F-ACB9-0BB5CD32D719}]
2025-02-24 19:39:20.767 (   0.965s) [main thread     ]             loguru.cpp:548   INFO| atexit





arguments: F:\\code\\vscodecpp\\tshark\\build\\tshark.exe
Current dir: F:\code\vscodecpp\tshark\build
File verbosity level: 9
date       time         ( uptime  ) [ thread name/id ]                   file:line     v| 
2025-02-25 12:34:40.646 (   0.023s) [main thread     ]             loguru.cpp:851   INFO| Logging to 'log.txt', mode: 'a', verbosity: 9
2025-02-25 12:34:41.263 (   0.639s) [main thread     ]      tsharkManager.cpp:180   INFO| {"frame_number":30,"timestamp":"2025-02-22 12:34:54.720979","src_mac":"30:89:4a:d4:25:ce","dst_mac":"b0:76:1b:21:30:ab","src_ip":"","src_location":"","src_port":0,"dst_ip":"","dst_location":"","dst_port":0,"protocol":"ARP","info":"10.199.217.176 is at 30:89:4a:d4:25:ce","file_offset":4953,"cap_len":42,"len":42}
2025-02-25 12:34:41.271 (   0.648s) [main thread     ]      tsharkManager.cpp:180   INFO| {"frame_number":13,"timestamp":"2025-02-22 12:34:53.526130","src_mac":"30:89:4a:d4:25:ce","dst_mac":"b0:76:1b:21:30:ab","src_ip":"10.199.217.176","src_location":"å†…ç½‘","src_port":80,"dst_ip":"123.56.161.176","dst_location":"ä¸­å›½-åŒ—äº¬-åŒ—äº¬å¸‚","dst_port":0,"protocol":"TCP","info":"36673 â†’ 80 [SYN] Seq=0 Win=65535 Len=0 MSS=1460 WS=256 SACK_PERM","file_offset":2261,"cap_len":66,"len":66}
2025-02-25 12:34:41.285 (   0.661s) [main thread     ]      tsharkManager.cpp:180   INFO| {"frame_number":12,"timestamp":"2025-02-22 12:34:53.501620","src_mac":"30:89:4a:d4:25:ce","dst_mac":"b0:76:1b:21:30:ab","src_ip":"10.199.217.176","src_location":"å†…ç½‘","src_port":80,"dst_ip":"123.56.161.176","dst_location":"ä¸­å›½-åŒ—äº¬-åŒ—äº¬å¸‚","dst_port":0,"protocol":"TCP","info":"36672 â†’ 80 [SYN] Seq=0 Win=65535 Len=0 MSS=1460 WS=256 SACK_PERM","file_offset":2179,"cap_len":66,"len":66}
2025-02-25 12:34:41.298 (   0.675s) [main thread     ]      tsharkManager.cpp:180   INFO| {"frame_number":11,"timestamp":"2025-02-22 12:34:53.497669","src_mac":"b0:76:1b:21:30:ab","dst_mac":"30:89:4a:d4:25:ce","src_ip":"114.114.114.114","src_location":"ä¸­å›½-æ±Ÿè‹çœ-å—äº¬å¸‚","src_port":56718,"dst_ip":"10.199.217.176","dst_location":"å†…ç½‘","dst_port":0,"protocol":"DNS","info":"Standard query response 0xba3d A api.pdfxd.com A 123.56.161.176","file_offset":2074,"cap_len":89,"len":89}
2025-02-25 12:34:41.311 (   0.688s) [main thread     ]      tsharkManager.cpp:180   INFO| {"frame_number":10,"timestamp":"2025-02-22 12:34:53.477857","src_mac":"30:89:4a:d4:25:ce","dst_mac":"b0:76:1b:21:30:ab","src_ip":"10.199.217.176","src_location":"å†…ç½‘","src_port":53,"dst_ip":"114.114.114.114","dst_location":"ä¸­å›½-æ±Ÿè‹çœ-å—äº¬å¸‚","dst_port":0,"protocol":"DNS","info":"Standard query 0xba3d A api.pdfxd.com","file_offset":1985,"cap_len":73,"len":73}
2025-02-25 12:34:41.324 (   0.701s) [main thread     ]      tsharkManager.cpp:180   INFO| {"frame_number":9,"timestamp":"2025-02-22 12:34:53.422618","src_mac":"b0:76:1b:21:30:ab","dst_mac":"30:89:4a:d4:25:ce","src_ip":"20.189.173.8","src_location":"ç¾å›½-åŠ åˆ©ç¦å°¼äºš-åœ£ä½•å¡","src_port":36641,"dst_ip":"10.199.217.176","dst_location":"å†…ç½‘","dst_port":0,"protocol":"TCP","info":"443 â†’ 36641 [ACK] Seq=100 Ack=972 Win=16381 Len=0","file_offset":1909,"cap_len":60,"len":60}
2025-02-25 12:34:41.336 (   0.713s) [main thread     ]      tsharkManager.cpp:180   INFO| {"frame_number":8,"timestamp":"2025-02-22 12:34:53.369397","src_mac":"30:89:4a:d4:25:ce","dst_mac":"b0:76:1b:21:30:ab","src_ip":"10.199.217.176","src_location":"å†…ç½‘","src_port":8080,"dst_ip":"157.148.54.28","dst_location":"ä¸­å›½-å¹¿ä¸œçœ-å¹¿å·å¸‚","dst_port":0,"protocol":"TCP","info":"56769 â†’ 8080 [ACK] Seq=154 Ack=81 Win=515 Len=0","file_offset":1839,"cap_len":54,"len":54}
2025-02-25 12:34:41.347 (   0.724s) [main thread     ]      tsharkManager.cpp:180   INFO| {"frame_number":7,"timestamp":"2025-02-22 12:34:53.322117","src_mac":"b0:76:1b:21:30:ab","dst_mac":"30:89:4a:d4:25:ce","src_ip":"157.148.54.28","src_location":"ä¸­å›½-å¹¿ä¸œçœ-å¹¿å·å¸‚","src_port":56769,"dst_ip":"10.199.217.176","dst_location":"å†…ç½‘","dst_port":0,"protocol":"TCP","info":"8080 â†’ 56769 [PSH, ACK] Seq=1 Ack=154 Win=4098 Len=80","file_offset":1689,"cap_len":134,"len":134}
2025-02-25 12:34:41.364 (   0.740s) [main thread     ]      tsharkManager.cpp:180   INFO| {"frame_number":6,"timestamp":"2025-02-22 12:34:53.274350","src_mac":"30:89:4a:d4:25:ce","dst_mac":"b0:76:1b:21:30:ab","src_ip":"10.199.217.176","src_location":"å†…ç½‘","src_port":8080,"dst_ip":"157.148.54.28","dst_location":"ä¸­å›½-å¹¿ä¸œçœ-å¹¿å·å¸‚","dst_port":0,"protocol":"TCP","info":"56769 â†’ 8080 [PSH, ACK] Seq=1 Ack=1 Win=515 Len=153","file_offset":1466,"cap_len":207,"len":207}
2025-02-25 12:34:41.383 (   0.759s) [main thread     ]      tsharkManager.cpp:180   INFO| {"frame_number":5,"timestamp":"2025-02-22 12:34:53.154173","src_mac":"30:89:4a:d4:25:ce","dst_mac":"b0:76:1b:21:30:ab","src_ip":"10.199.217.176","src_location":"å†…ç½‘","src_port":443,"dst_ip":"20.189.173.8","dst_location":"ç¾å›½-åŠ åˆ©ç¦å°¼äºš-åœ£ä½•å¡","dst_port":0,"protocol":"TLSv1.2","info":"Application Data","file_offset":1361,"cap_len":89,"len":89}
2025-02-25 12:34:41.396 (   0.772s) [main thread     ]      tsharkManager.cpp:180   INFO| {"frame_number":4,"timestamp":"2025-02-22 12:34:53.152758","src_mac":"b0:76:1b:21:30:ab","dst_mac":"30:89:4a:d4:25:ce","src_ip":"20.189.173.8","src_location":"ç¾å›½-åŠ åˆ©ç¦å°¼äºš-åœ£ä½•å¡","src_port":36641,"dst_ip":"10.199.217.176","dst_location":"å†…ç½‘","dst_port":0,"protocol":"TLSv1.2","info":"Application Data","file_offset":1192,"cap_len":153,"len":153}
2025-02-25 12:34:41.412 (   0.788s) [main thread     ]      tsharkManager.cpp:180   INFO| {"frame_number":3,"timestamp":"2025-02-22 12:34:53.152758","src_mac":"b0:76:1b:21:30:ab","dst_mac":"30:89:4a:d4:25:ce","src_ip":"20.189.173.8","src_location":"ç¾å›½-åŠ åˆ©ç¦å°¼äºš-åœ£ä½•å¡","src_port":36641,"dst_ip":"10.199.217.176","dst_location":"å†…ç½‘","dst_port":0,"protocol":"TCP","info":"443 â†’ 36641 [ACK] Seq=1 Ack=937 Win=16381 Len=0","file_offset":1116,"cap_len":60,"len":60}
2025-02-25 12:34:41.424 (   0.800s) [main thread     ]      tsharkManager.cpp:180   INFO| {"frame_number":2,"timestamp":"2025-02-22 12:34:52.899472","src_mac":"30:89:4a:d4:25:ce","dst_mac":"b0:76:1b:21:30:ab","src_ip":"10.199.217.176","src_location":"å†…ç½‘","src_port":443,"dst_ip":"20.189.173.8","dst_location":"ç¾å›½-åŠ åˆ©ç¦å°¼äºš-åœ£ä½•å¡","dst_port":0,"protocol":"TLSv1.2","info":"Application Data","file_offset":194,"cap_len":906,"len":906}
2025-02-25 12:34:41.479 (   0.855s) [main thread     ]      tsharkManager.cpp:180   INFO| {"frame_number":1,"timestamp":"2025-02-22 12:34:52.899381","src_mac":"30:89:4a:d4:25:ce","dst_mac":"b0:76:1b:21:30:ab","src_ip":"10.199.217.176","src_location":"å†…ç½‘","src_port":443,"dst_ip":"20.189.173.8","dst_location":"ç¾å›½-åŠ åˆ©ç¦å°¼äºš-åœ£ä½•å¡","dst_port":0,"protocol":"TLSv1.2","info":"Application Data","file_offset":40,"cap_len":138,"len":138}
2025-02-25 12:34:41.494 (   0.871s) [main thread     ]      tsharkManager.cpp:180   INFO| {"frame_number":14,"timestamp":"2025-02-22 12:34:53.530627","src_mac":"b0:76:1b:21:30:ab","dst_mac":"30:89:4a:d4:25:ce","src_ip":"123.56.161.176","src_location":"ä¸­å›½-åŒ—äº¬-åŒ—äº¬å¸‚","src_port":36672,"dst_ip":"10.199.217.176","dst_location":"å†…ç½‘","dst_port":0,"protocol":"TCP","info":"80 â†’ 36672 [SYN, ACK] Seq=0 Ack=1 Win=29200 Len=0 MSS=1440 SACK_PERM WS=512","file_offset":2343,"cap_len":66,"len":66}
2025-02-25 12:34:41.507 (   0.884s) [main thread     ]      tsharkManager.cpp:180   INFO| {"frame_number":15,"timestamp":"2025-02-22 12:34:53.530716","src_mac":"30:89:4a:d4:25:ce","dst_mac":"b0:76:1b:21:30:ab","src_ip":"10.199.217.176","src_location":"å†…ç½‘","src_port":80,"dst_ip":"123.56.161.176","dst_location":"ä¸­å›½-åŒ—äº¬-åŒ—äº¬å¸‚","dst_port":0,"protocol":"TCP","info":"36672 â†’ 80 [ACK] Seq=1 Ack=1 Win=262144 Len=0","file_offset":2425,"cap_len":54,"len":54}
2025-02-25 12:34:41.519 (   0.895s) [main thread     ]      tsharkManager.cpp:180   INFO| {"frame_number":16,"timestamp":"2025-02-22 12:34:53.530822","src_mac":"30:89:4a:d4:25:ce","dst_mac":"b0:76:1b:21:30:ab","src_ip":"10.199.217.176","src_location":"å†…ç½‘","src_port":80,"dst_ip":"123.56.161.176","dst_location":"ä¸­å›½-åŒ—äº¬-åŒ—äº¬å¸‚","dst_port":0,"protocol":"HTTP/JSON","info":"POST /pdf-service/v1/report HTTP/1.1 , JSON (application/json)","file_offset":2495,"cap_len":619,"len":619}
2025-02-25 12:34:41.560 (   0.936s) [main thread     ]      tsharkManager.cpp:180   INFO| {"frame_number":17,"timestamp":"2025-02-22 12:34:53.554641","src_mac":"b0:76:1b:21:30:ab","dst_mac":"30:89:4a:d4:25:ce","src_ip":"123.56.161.176","src_location":"ä¸­å›½-åŒ—äº¬-åŒ—äº¬å¸‚","src_port":36673,"dst_ip":"10.199.217.176","dst_location":"å†…ç½‘","dst_port":0,"protocol":"TCP","info":"80 â†’ 36673 [SYN, ACK] Seq=0 Ack=1 Win=29200 Len=0 MSS=1440 SACK_PERM WS=512","file_offset":3130,"cap_len":66,"len":66}
2025-02-25 12:34:41.573 (   0.949s) [main thread     ]      tsharkManager.cpp:180   INFO| {"frame_number":18,"timestamp":"2025-02-22 12:34:53.554723","src_mac":"30:89:4a:d4:25:ce","dst_mac":"b0:76:1b:21:30:ab","src_ip":"10.199.217.176","src_location":"å†…ç½‘","src_port":80,"dst_ip":"123.56.161.176","dst_location":"ä¸­å›½-åŒ—äº¬-åŒ—äº¬å¸‚","dst_port":0,"protocol":"TCP","info":"36673 â†’ 80 [ACK] Seq=1 Ack=1 Win=262144 Len=0","file_offset":3212,"cap_len":54,"len":54}
2025-02-25 12:34:41.584 (   0.961s) [main thread     ]      tsharkManager.cpp:180   INFO| {"frame_number":19,"timestamp":"2025-02-22 12:34:53.554904","src_mac":"30:89:4a:d4:25:ce","dst_mac":"b0:76:1b:21:30:ab","src_ip":"10.199.217.176","src_location":"å†…ç½‘","src_port":80,"dst_ip":"123.56.161.176","dst_location":"ä¸­å›½-åŒ—äº¬-åŒ—äº¬å¸‚","dst_port":0,"protocol":"HTTP/JSON","info":"POST /pdf-service/v1/report HTTP/1.1 , JSON (application/json)","file_offset":3282,"cap_len":613,"len":613}
2025-02-25 12:34:41.626 (   1.002s) [main thread     ]      tsharkManager.cpp:180   INFO| {"frame_number":20,"timestamp":"2025-02-22 12:34:53.556484","src_mac":"b0:76:1b:21:30:ab","dst_mac":"30:89:4a:d4:25:ce","src_ip":"123.56.161.176","src_location":"ä¸­å›½-åŒ—äº¬-åŒ—äº¬å¸‚","src_port":36672,"dst_ip":"10.199.217.176","dst_location":"å†…ç½‘","dst_port":0,"protocol":"TCP","info":"80 â†’ 36672 [ACK] Seq=1 Ack=566 Win=30720 Len=0","file_offset":3911,"cap_len":60,"len":60}
2025-02-25 12:34:41.638 (   1.014s) [main thread     ]      tsharkManager.cpp:180   INFO| {"frame_number":21,"timestamp":"2025-02-22 12:34:53.561487","src_mac":"b0:76:1b:21:30:ab","dst_mac":"30:89:4a:d4:25:ce","src_ip":"123.56.161.176","src_location":"ä¸­å›½-åŒ—äº¬-åŒ—äº¬å¸‚","src_port":36672,"dst_ip":"10.199.217.176","dst_location":"å†…ç½‘","dst_port":0,"protocol":"HTTP/JSON","info":"HTTP/1.1 200 OK , JSON (application/json)","file_offset":3987,"cap_len":215,"len":215}
2025-02-25 12:34:41.658 (   1.035s) [main thread     ]      tsharkManager.cpp:180   INFO| {"frame_number":22,"timestamp":"2025-02-22 12:34:53.561554","src_mac":"30:89:4a:d4:25:ce","dst_mac":"b0:76:1b:21:30:ab","src_ip":"10.199.217.176","src_location":"å†…ç½‘","src_port":80,"dst_ip":"123.56.161.176","dst_location":"ä¸­å›½-åŒ—äº¬-åŒ—äº¬å¸‚","dst_port":0,"protocol":"TCP","info":"36672 â†’ 80 [ACK] Seq=566 Ack=162 Win=261888 Len=0","file_offset":4218,"cap_len":54,"len":54}
2025-02-25 12:34:41.670 (   1.047s) [main thread     ]      tsharkManager.cpp:180   INFO| {"frame_number":23,"timestamp":"2025-02-22 12:34:53.564882","src_mac":"30:89:4a:d4:25:ce","dst_mac":"b0:76:1b:21:30:ab","src_ip":"10.199.217.176","src_location":"å†…ç½‘","src_port":80,"dst_ip":"123.56.161.176","dst_location":"ä¸­å›½-åŒ—äº¬-åŒ—äº¬å¸‚","dst_port":0,"protocol":"TCP","info":"36672 â†’ 80 [RST, ACK] Seq=566 Ack=162 Win=0 Len=0","file_offset":4288,"cap_len":54,"len":54}
2025-02-25 12:34:41.681 (   1.058s) [main thread     ]      tsharkManager.cpp:180   INFO| {"frame_number":24,"timestamp":"2025-02-22 12:34:53.592374","src_mac":"b0:76:1b:21:30:ab","dst_mac":"30:89:4a:d4:25:ce","src_ip":"123.56.161.176","src_location":"ä¸­å›½-åŒ—äº¬-åŒ—äº¬å¸‚","src_port":36672,"dst_ip":"10.199.217.176","dst_location":"å†…ç½‘","dst_port":0,"protocol":"TCP","info":"80 â†’ 36672 [RST] Seq=162 Win=0 Len=0","file_offset":4358,"cap_len":60,"len":60}
2025-02-25 12:34:41.692 (   1.069s) [main thread     ]      tsharkManager.cpp:180   INFO| {"frame_number":25,"timestamp":"2025-02-22 12:34:53.594427","src_mac":"b0:76:1b:21:30:ab","dst_mac":"30:89:4a:d4:25:ce","src_ip":"123.56.161.176","src_location":"ä¸­å›½-åŒ—äº¬-åŒ—äº¬å¸‚","src_port":36673,"dst_ip":"10.199.217.176","dst_location":"å†…ç½‘","dst_port":0,"protocol":"TCP","info":"80 â†’ 36673 [ACK] Seq=1 Ack=560 Win=30720 Len=0","file_offset":4434,"cap_len":60,"len":60}
2025-02-25 12:34:41.706 (   1.083s) [main thread     ]      tsharkManager.cpp:180   INFO| {"frame_number":26,"timestamp":"2025-02-22 12:34:53.599127","src_mac":"b0:76:1b:21:30:ab","dst_mac":"30:89:4a:d4:25:ce","src_ip":"123.56.161.176","src_location":"ä¸­å›½-åŒ—äº¬-åŒ—äº¬å¸‚","src_port":36673,"dst_ip":"10.199.217.176","dst_location":"å†…ç½‘","dst_port":0,"protocol":"HTTP/JSON","info":"HTTP/1.1 200 OK , JSON (application/json)","file_offset":4510,"cap_len":215,"len":215}
