




arguments: F:\\code\\vscodecpp\\tshark\\build\\tshark.exe
Current dir: F:\code\vscodecpp\tshark\build
File verbosity level: 9
date       time         ( uptime  ) [ thread name/id ]                   file:line     v| 
2025-02-23 15:21:55.521 (   0.013s) [main thread     ]             loguru.cpp:851   INFO| Logging to 'log.txt', mode: 'a', verbosity: 9
2025-02-23 15:21:55.705 (   0.197s) [main thread     ]      tsharkManager.cpp:176   INFO| {"frame_number":30,"timestamp":"2025-02-22 12:34:54.720979","src_mac":"30:89:4a:d4:25:ce","dst_mac":"b0:76:1b:21:30:ab","src_ip":"","src_location":"","src_port":0,"dst_ip":"","dst_location":"","dst_port":0,"protocol":"ARP","info":"10.199.217.176 is at 30:89:4a:d4:25:ce","file_offset":4953,"cap_len":42,"len":42}
2025-02-23 15:21:55.718 (   0.210s) [main thread     ]      tsharkManager.cpp:180   INFO| Packet Hex Data: 
2025-02-23 15:21:55.723 (   0.215s) [main thread     ]      tsharkManager.cpp:176   INFO| {"frame_number":13,"timestamp":"2025-02-22 12:34:53.526130","src_mac":"30:89:4a:d4:25:ce","dst_mac":"b0:76:1b:21:30:ab","src_ip":"10.199.217.176","src_location":"内网","src_port":80,"dst_ip":"123.56.161.176","dst_location":"中国-北京-北京市","dst_port":0,"protocol":"TCP","info":"36673 → 80 [SYN] Seq=0 Win=65535 Len=0 MSS=1460 WS=256 SACK_PERM","file_offset":2261,"cap_len":66,"len":66}
2025-02-23 15:21:55.731 (   0.223s) [main thread     ]      tsharkManager.cpp:180   INFO| Packet Hex Data: 
2025-02-23 15:21:55.737 (   0.229s) [main thread     ]      tsharkManager.cpp:176   INFO| {"frame_number":12,"timestamp":"2025-02-22 12:34:53.501620","src_mac":"30:89:4a:d4:25:ce","dst_mac":"b0:76:1b:21:30:ab","src_ip":"10.199.217.176","src_location":"内网","src_port":80,"dst_ip":"123.56.161.176","dst_location":"中国-北京-北京市","dst_port":0,"protocol":"TCP","info":"36672 → 80 [SYN] Seq=0 Win=65535 Len=0 MSS=1460 WS=256 SACK_PERM","file_offset":2179,"cap_len":66,"len":66}
2025-02-23 15:21:55.746 (   0.238s) [main thread     ]      tsharkManager.cpp:180   INFO| Packet Hex Data: 
2025-02-23 15:21:55.753 (   0.245s) [main thread     ]      tsharkManager.cpp:176   INFO| {"frame_number":11,"timestamp":"2025-02-22 12:34:53.497669","src_mac":"b0:76:1b:21:30:ab","dst_mac":"30:89:4a:d4:25:ce","src_ip":"114.114.114.114","src_location":"中国-江苏省-南京市","src_port":56718,"dst_ip":"10.199.217.176","dst_location":"内网","dst_port":0,"protocol":"DNS","info":"Standard query response 0xba3d A api.pdfxd.com A 123.56.161.176","file_offset":2074,"cap_len":89,"len":89}
2025-02-23 15:21:55.768 (   0.260s) [main thread     ]      tsharkManager.cpp:180   INFO| Packet Hex Data: 
2025-02-23 15:21:55.775 (   0.267s) [main thread     ]      tsharkManager.cpp:176   INFO| {"frame_number":10,"timestamp":"2025-02-22 12:34:53.477857","src_mac":"30:89:4a:d4:25:ce","dst_mac":"b0:76:1b:21:30:ab","src_ip":"10.199.217.176","src_location":"内网","src_port":53,"dst_ip":"114.114.114.114","dst_location":"中国-江苏省-南京市","dst_port":0,"protocol":"DNS","info":"Standard query 0xba3d A api.pdfxd.com","file_offset":1985,"cap_len":73,"len":73}
2025-02-23 15:21:55.783 (   0.275s) [main thread     ]      tsharkManager.cpp:180   INFO| Packet Hex Data: 
2025-02-23 15:21:55.789 (   0.281s) [main thread     ]      tsharkManager.cpp:176   INFO| {"frame_number":9,"timestamp":"2025-02-22 12:34:53.422618","src_mac":"b0:76:1b:21:30:ab","dst_mac":"30:89:4a:d4:25:ce","src_ip":"20.189.173.8","src_location":"美国-加利福尼亚-圣何塞","src_port":36641,"dst_ip":"10.199.217.176","dst_location":"内网","dst_port":0,"protocol":"TCP","info":"443 → 36641 [ACK] Seq=100 Ack=972 Win=16381 Len=0","file_offset":1909,"cap_len":60,"len":60}
2025-02-23 15:21:55.797 (   0.289s) [main thread     ]      tsharkManager.cpp:180   INFO| Packet Hex Data: 
2025-02-23 15:21:55.803 (   0.295s) [main thread     ]      tsharkManager.cpp:176   INFO| {"frame_number":8,"timestamp":"2025-02-22 12:34:53.369397","src_mac":"30:89:4a:d4:25:ce","dst_mac":"b0:76:1b:21:30:ab","src_ip":"10.199.217.176","src_location":"内网","src_port":8080,"dst_ip":"157.148.54.28","dst_location":"中国-广东省-广州市","dst_port":0,"protocol":"TCP","info":"56769 → 8080 [ACK] Seq=154 Ack=81 Win=515 Len=0","file_offset":1839,"cap_len":54,"len":54}
2025-02-23 15:21:55.812 (   0.304s) [main thread     ]      tsharkManager.cpp:180   INFO| Packet Hex Data: 
2025-02-23 15:21:55.817 (   0.309s) [main thread     ]      tsharkManager.cpp:176   INFO| {"frame_number":7,"timestamp":"2025-02-22 12:34:53.322117","src_mac":"b0:76:1b:21:30:ab","dst_mac":"30:89:4a:d4:25:ce","src_ip":"157.148.54.28","src_location":"中国-广东省-广州市","src_port":56769,"dst_ip":"10.199.217.176","dst_location":"内网","dst_port":0,"protocol":"TCP","info":"8080 → 56769 [PSH, ACK] Seq=1 Ack=154 Win=4098 Len=80","file_offset":1689,"cap_len":134,"len":134}
2025-02-23 15:21:55.826 (   0.318s) [main thread     ]      tsharkManager.cpp:180   INFO| Packet Hex Data: 
2025-02-23 15:21:55.836 (   0.328s) [main thread     ]      tsharkManager.cpp:176   INFO| {"frame_number":6,"timestamp":"2025-02-22 12:34:53.274350","src_mac":"30:89:4a:d4:25:ce","dst_mac":"b0:76:1b:21:30:ab","src_ip":"10.199.217.176","src_location":"内网","src_port":8080,"dst_ip":"157.148.54.28","dst_location":"中国-广东省-广州市","dst_port":0,"protocol":"TCP","info":"56769 → 8080 [PSH, ACK] Seq=1 Ack=1 Win=515 Len=153","file_offset":1466,"cap_len":207,"len":207}
2025-02-23 15:21:55.845 (   0.337s) [main thread     ]      tsharkManager.cpp:180   INFO| Packet Hex Data: 
2025-02-23 15:21:55.859 (   0.351s) [main thread     ]      tsharkManager.cpp:176   INFO| {"frame_number":5,"timestamp":"2025-02-22 12:34:53.154173","src_mac":"30:89:4a:d4:25:ce","dst_mac":"b0:76:1b:21:30:ab","src_ip":"10.199.217.176","src_location":"内网","src_port":443,"dst_ip":"20.189.173.8","dst_location":"美国-加利福尼亚-圣何塞","dst_port":0,"protocol":"TLSv1.2","info":"Application Data","file_offset":1361,"cap_len":89,"len":89}
2025-02-23 15:21:55.868 (   0.360s) [main thread     ]      tsharkManager.cpp:180   INFO| Packet Hex Data: 
2025-02-23 15:21:55.875 (   0.368s) [main thread     ]      tsharkManager.cpp:176   INFO| {"frame_number":4,"timestamp":"2025-02-22 12:34:53.152758","src_mac":"b0:76:1b:21:30:ab","dst_mac":"30:89:4a:d4:25:ce","src_ip":"20.189.173.8","src_location":"美国-加利福尼亚-圣何塞","src_port":36641,"dst_ip":"10.199.217.176","dst_location":"内网","dst_port":0,"protocol":"TLSv1.2","info":"Application Data","file_offset":1192,"cap_len":153,"len":153}
2025-02-23 15:21:55.886 (   0.378s) [main thread     ]      tsharkManager.cpp:180   INFO| Packet Hex Data: 
2025-02-23 15:21:55.897 (   0.389s) [main thread     ]      tsharkManager.cpp:176   INFO| {"frame_number":3,"timestamp":"2025-02-22 12:34:53.152758","src_mac":"b0:76:1b:21:30:ab","dst_mac":"30:89:4a:d4:25:ce","src_ip":"20.189.173.8","src_location":"美国-加利福尼亚-圣何塞","src_port":36641,"dst_ip":"10.199.217.176","dst_location":"内网","dst_port":0,"protocol":"TCP","info":"443 → 36641 [ACK] Seq=1 Ack=937 Win=16381 Len=0","file_offset":1116,"cap_len":60,"len":60}
2025-02-23 15:21:55.906 (   0.398s) [main thread     ]      tsharkManager.cpp:180   INFO| Packet Hex Data: 
2025-02-23 15:21:55.912 (   0.404s) [main thread     ]      tsharkManager.cpp:176   INFO| {"frame_number":2,"timestamp":"2025-02-22 12:34:52.899472","src_mac":"30:89:4a:d4:25:ce","dst_mac":"b0:76:1b:21:30:ab","src_ip":"10.199.217.176","src_location":"内网","src_port":443,"dst_ip":"20.189.173.8","dst_location":"美国-加利福尼亚-圣何塞","dst_port":0,"protocol":"TLSv1.2","info":"Application Data","file_offset":194,"cap_len":906,"len":906}
2025-02-23 15:21:55.922 (   0.414s) [main thread     ]      tsharkManager.cpp:180   INFO| Packet Hex Data: 
2025-02-23 15:21:55.989 (   0.481s) [main thread     ]      tsharkManager.cpp:176   INFO| {"frame_number":1,"timestamp":"2025-02-22 12:34:52.899381","src_mac":"30:89:4a:d4:25:ce","dst_mac":"b0:76:1b:21:30:ab","src_ip":"10.199.217.176","src_location":"内网","src_port":443,"dst_ip":"20.189.173.8","dst_location":"美国-加利福尼亚-圣何塞","dst_port":0,"protocol":"TLSv1.2","info":"Application Data","file_offset":40,"cap_len":138,"len":138}
2025-02-23 15:21:55.998 (   0.490s) [main thread     ]      tsharkManager.cpp:180   INFO| Packet Hex Data: 
2025-02-23 15:21:56.007 (   0.499s) [main thread     ]      tsharkManager.cpp:176   INFO| {"frame_number":14,"timestamp":"2025-02-22 12:34:53.530627","src_mac":"b0:76:1b:21:30:ab","dst_mac":"30:89:4a:d4:25:ce","src_ip":"123.56.161.176","src_location":"中国-北京-北京市","src_port":36672,"dst_ip":"10.199.217.176","dst_location":"内网","dst_port":0,"protocol":"TCP","info":"80 → 36672 [SYN, ACK] Seq=0 Ack=1 Win=29200 Len=0 MSS=1440 SACK_PERM WS=512","file_offset":2343,"cap_len":66,"len":66}
2025-02-23 15:21:56.017 (   0.509s) [main thread     ]      tsharkManager.cpp:180   INFO| Packet Hex Data: 
2025-02-23 15:21:56.024 (   0.516s) [main thread     ]      tsharkManager.cpp:176   INFO| {"frame_number":15,"timestamp":"2025-02-22 12:34:53.530716","src_mac":"30:89:4a:d4:25:ce","dst_mac":"b0:76:1b:21:30:ab","src_ip":"10.199.217.176","src_location":"内网","src_port":80,"dst_ip":"123.56.161.176","dst_location":"中国-北京-北京市","dst_port":0,"protocol":"TCP","info":"36672 → 80 [ACK] Seq=1 Ack=1 Win=262144 Len=0","file_offset":2425,"cap_len":54,"len":54}
2025-02-23 15:21:56.032 (   0.524s) [main thread     ]      tsharkManager.cpp:180   INFO| Packet Hex Data: 
2025-02-23 15:21:56.037 (   0.529s) [main thread     ]      tsharkManager.cpp:176   INFO| {"frame_number":16,"timestamp":"2025-02-22 12:34:53.530822","src_mac":"30:89:4a:d4:25:ce","dst_mac":"b0:76:1b:21:30:ab","src_ip":"10.199.217.176","src_location":"内网","src_port":80,"dst_ip":"123.56.161.176","dst_location":"中国-北京-北京市","dst_port":0,"protocol":"HTTP/JSON","info":"POST /pdf-service/v1/report HTTP/1.1 , JSON (application/json)","file_offset":2495,"cap_len":619,"len":619}
2025-02-23 15:21:56.045 (   0.537s) [main thread     ]      tsharkManager.cpp:180   INFO| Packet Hex Data: 
2025-02-23 15:21:56.082 (   0.574s) [main thread     ]      tsharkManager.cpp:176   INFO| {"frame_number":17,"timestamp":"2025-02-22 12:34:53.554641","src_mac":"b0:76:1b:21:30:ab","dst_mac":"30:89:4a:d4:25:ce","src_ip":"123.56.161.176","src_location":"中国-北京-北京市","src_port":36673,"dst_ip":"10.199.217.176","dst_location":"内网","dst_port":0,"protocol":"TCP","info":"80 → 36673 [SYN, ACK] Seq=0 Ack=1 Win=29200 Len=0 MSS=1440 SACK_PERM WS=512","file_offset":3130,"cap_len":66,"len":66}
2025-02-23 15:21:56.092 (   0.584s) [main thread     ]      tsharkManager.cpp:180   INFO| Packet Hex Data: 
2025-02-23 15:21:56.098 (   0.590s) [main thread     ]      tsharkManager.cpp:176   INFO| {"frame_number":18,"timestamp":"2025-02-22 12:34:53.554723","src_mac":"30:89:4a:d4:25:ce","dst_mac":"b0:76:1b:21:30:ab","src_ip":"10.199.217.176","src_location":"内网","src_port":80,"dst_ip":"123.56.161.176","dst_location":"中国-北京-北京市","dst_port":0,"protocol":"TCP","info":"36673 → 80 [ACK] Seq=1 Ack=1 Win=262144 Len=0","file_offset":3212,"cap_len":54,"len":54}
2025-02-23 15:21:56.108 (   0.600s) [main thread     ]      tsharkManager.cpp:180   INFO| Packet Hex Data: 
2025-02-23 15:21:56.112 (   0.604s) [main thread     ]      tsharkManager.cpp:176   INFO| {"frame_number":19,"timestamp":"2025-02-22 12:34:53.554904","src_mac":"30:89:4a:d4:25:ce","dst_mac":"b0:76:1b:21:30:ab","src_ip":"10.199.217.176","src_location":"内网","src_port":80,"dst_ip":"123.56.161.176","dst_location":"中国-北京-北京市","dst_port":0,"protocol":"HTTP/JSON","info":"POST /pdf-service/v1/report HTTP/1.1 , JSON (application/json)","file_offset":3282,"cap_len":613,"len":613}
2025-02-23 15:21:56.122 (   0.615s) [main thread     ]      tsharkManager.cpp:180   INFO| Packet Hex Data: 
2025-02-23 15:21:56.156 (   0.648s) [main thread     ]      tsharkManager.cpp:176   INFO| {"frame_number":20,"timestamp":"2025-02-22 12:34:53.556484","src_mac":"b0:76:1b:21:30:ab","dst_mac":"30:89:4a:d4:25:ce","src_ip":"123.56.161.176","src_location":"中国-北京-北京市","src_port":36672,"dst_ip":"10.199.217.176","dst_location":"内网","dst_port":0,"protocol":"TCP","info":"80 → 36672 [ACK] Seq=1 Ack=566 Win=30720 Len=0","file_offset":3911,"cap_len":60,"len":60}
2025-02-23 15:21:56.166 (   0.658s) [main thread     ]      tsharkManager.cpp:180   INFO| Packet Hex Data: 
2025-02-23 15:21:56.171 (   0.663s) [main thread     ]      tsharkManager.cpp:176   INFO| {"frame_number":21,"timestamp":"2025-02-22 12:34:53.561487","src_mac":"b0:76:1b:21:30:ab","dst_mac":"30:89:4a:d4:25:ce","src_ip":"123.56.161.176","src_location":"中国-北京-北京市","src_port":36672,"dst_ip":"10.199.217.176","dst_location":"内网","dst_port":0,"protocol":"HTTP/JSON","info":"HTTP/1.1 200 OK , JSON (application/json)","file_offset":3987,"cap_len":215,"len":215}
2025-02-23 15:21:56.181 (   0.673s) [main thread     ]      tsharkManager.cpp:180   INFO| Packet Hex Data: 
2025-02-23 15:21:56.194 (   0.686s) [main thread     ]      tsharkManager.cpp:176   INFO| {"frame_number":22,"timestamp":"2025-02-22 12:34:53.561554","src_mac":"30:89:4a:d4:25:ce","dst_mac":"b0:76:1b:21:30:ab","src_ip":"10.199.217.176","src_location":"内网","src_port":80,"dst_ip":"123.56.161.176","dst_location":"中国-北京-北京市","dst_port":0,"protocol":"TCP","info":"36672 → 80 [ACK] Seq=566 Ack=162 Win=261888 Len=0","file_offset":4218,"cap_len":54,"len":54}
2025-02-23 15:21:56.203 (   0.695s) [main thread     ]      tsharkManager.cpp:180   INFO| Packet Hex Data: 
2025-02-23 15:21:56.208 (   0.700s) [main thread     ]      tsharkManager.cpp:176   INFO| {"frame_number":23,"timestamp":"2025-02-22 12:34:53.564882","src_mac":"30:89:4a:d4:25:ce","dst_mac":"b0:76:1b:21:30:ab","src_ip":"10.199.217.176","src_location":"内网","src_port":80,"dst_ip":"123.56.161.176","dst_location":"中国-北京-北京市","dst_port":0,"protocol":"TCP","info":"36672 → 80 [RST, ACK] Seq=566 Ack=162 Win=0 Len=0","file_offset":4288,"cap_len":54,"len":54}
2025-02-23 15:21:56.218 (   0.710s) [main thread     ]      tsharkManager.cpp:180   INFO| Packet Hex Data: 
2025-02-23 15:21:56.225 (   0.717s) [main thread     ]      tsharkManager.cpp:176   INFO| {"frame_number":24,"timestamp":"2025-02-22 12:34:53.592374","src_mac":"b0:76:1b:21:30:ab","dst_mac":"30:89:4a:d4:25:ce","src_ip":"123.56.161.176","src_location":"中国-北京-北京市","src_port":36672,"dst_ip":"10.199.217.176","dst_location":"内网","dst_port":0,"protocol":"TCP","info":"80 → 36672 [RST] Seq=162 Win=0 Len=0","file_offset":4358,"cap_len":60,"len":60}
2025-02-23 15:21:56.233 (   0.725s) [main thread     ]      tsharkManager.cpp:180   INFO| Packet Hex Data: 
2025-02-23 15:21:56.240 (   0.732s) [main thread     ]      tsharkManager.cpp:176   INFO| {"frame_number":25,"timestamp":"2025-02-22 12:34:53.594427","src_mac":"b0:76:1b:21:30:ab","dst_mac":"30:89:4a:d4:25:ce","src_ip":"123.56.161.176","src_location":"中国-北京-北京市","src_port":36673,"dst_ip":"10.199.217.176","dst_location":"内网","dst_port":0,"protocol":"TCP","info":"80 → 36673 [ACK] Seq=1 Ack=560 Win=30720 Len=0","file_offset":4434,"cap_len":60,"len":60}
2025-02-23 15:21:56.249 (   0.741s) [main thread     ]      tsharkManager.cpp:180   INFO| Packet Hex Data: 
2025-02-23 15:21:56.256 (   0.748s) [main thread     ]      tsharkManager.cpp:176   INFO| {"frame_number":26,"timestamp":"2025-02-22 12:34:53.599127","src_mac":"b0:76:1b:21:30:ab","dst_mac":"30:89:4a:d4:25:ce","src_ip":"123.56.161.176","src_location":"中国-北京-北京市","src_port":36673,"dst_ip":"10.199.217.176","dst_location":"内网","dst_port":0,"protocol":"HTTP/JSON","info":"HTTP/1.1 200 OK , JSON (application/json)","file_offset":4510,"cap_len":215,"len":215}
2025-02-23 15:21:56.266 (   0.758s) [main thread     ]      tsharkManager.cpp:180   INFO| Packet Hex Data: 
2025-02-23 15:21:56.280 (   0.772s) [main thread     ]      tsharkManager.cpp:176   INFO| {"frame_number":27,"timestamp":"2025-02-22 12:34:53.599172","src_mac":"30:89:4a:d4:25:ce","dst_mac":"b0:76:1b:21:30:ab","src_ip":"10.199.217.176","src_location":"内网","src_port":80,"dst_ip":"123.56.161.176","dst_location":"中国-北京-北京市","dst_port":0,"protocol":"TCP","info":"36673 → 80 [ACK] Seq=560 Ack=162 Win=261888 Len=0","file_offset":4741,"cap_len":54,"len":54}
2025-02-23 15:21:56.289 (   0.781s) [main thread     ]      tsharkManager.cpp:180   INFO| Packet Hex Data: 
2025-02-23 15:21:56.294 (   0.786s) [main thread     ]      tsharkManager.cpp:176   INFO| {"frame_number":28,"timestamp":"2025-02-22 12:34:53.605450","src_mac":"30:89:4a:d4:25:ce","dst_mac":"b0:76:1b:21:30:ab","src_ip":"10.199.217.176","src_location":"内网","src_port":80,"dst_ip":"123.56.161.176","dst_location":"中国-北京-北京市","dst_port":0,"protocol":"TCP","info":"36673 → 80 [RST, ACK] Seq=560 Ack=162 Win=0 Len=0","file_offset":4811,"cap_len":54,"len":54}
2025-02-23 15:21:56.303 (   0.795s) [main thread     ]      tsharkManager.cpp:180   INFO| Packet Hex Data: 
2025-02-23 15:21:56.309 (   0.801s) [main thread     ]      tsharkManager.cpp:176   INFO| {"frame_number":29,"timestamp":"2025-02-22 12:34:54.720955","src_mac":"b0:76:1b:21:30:ab","dst_mac":"30:89:4a:d4:25:ce","src_ip":"","src_location":"","src_port":0,"dst_ip":"","dst_location":"","dst_port":0,"protocol":"ARP","info":"Who has 10.199.217.176? Tell 10.199.255.254","file_offset":4881,"cap_len":56,"len":56}
2025-02-23 15:21:56.317 (   0.809s) [main thread     ]      tsharkManager.cpp:180   INFO| Packet Hex Data: 
2025-02-23 15:21:56.322 (   0.814s) [main thread     ]      tsharkManager.cpp:186   INFO| 30 packets have been printed.
2025-02-23 15:21:56.324 (   0.816s) [main thread     ]             loguru.cpp:548   INFO| atexit





arguments: F:\\code\\vscodecpp\\tshark\\build\\tshark.exe
Current dir: F:\code\vscodecpp\tshark\build
File verbosity level: 9
date       time         ( uptime  ) [ thread name/id ]                   file:line     v| 
2025-02-23 20:47:08.942 (   0.033s) [main thread     ]             loguru.cpp:851   INFO| Logging to 'log.txt', mode: 'a', verbosity: 9
2025-02-23 20:47:09.536 (   0.628s) [main thread     ]      tsharkManager.cpp:176   INFO| {"frame_number":30,"timestamp":"2025-02-22 12:34:54.720979","src_mac":"30:89:4a:d4:25:ce","dst_mac":"b0:76:1b:21:30:ab","src_ip":"","src_location":"","src_port":0,"dst_ip":"","dst_location":"","dst_port":0,"protocol":"ARP","info":"10.199.217.176 is at 30:89:4a:d4:25:ce","file_offset":4953,"cap_len":42,"len":42}
2025-02-23 20:47:09.543 (   0.635s) [main thread     ]      tsharkManager.cpp:180   INFO| Packet Hex Data: 
2025-02-23 20:47:09.548 (   0.639s) [main thread     ]      tsharkManager.cpp:176   INFO| {"frame_number":13,"timestamp":"2025-02-22 12:34:53.526130","src_mac":"30:89:4a:d4:25:ce","dst_mac":"b0:76:1b:21:30:ab","src_ip":"10.199.217.176","src_location":"内网","src_port":80,"dst_ip":"123.56.161.176","dst_location":"中国-北京-北京市","dst_port":0,"protocol":"TCP","info":"36673 → 80 [SYN] Seq=0 Win=65535 Len=0 MSS=1460 WS=256 SACK_PERM","file_offset":2261,"cap_len":66,"len":66}
2025-02-23 20:47:09.559 (   0.651s) [main thread     ]      tsharkManager.cpp:180   INFO| Packet Hex Data: 
2025-02-23 20:47:09.566 (   0.657s) [main thread     ]      tsharkManager.cpp:176   INFO| {"frame_number":12,"timestamp":"2025-02-22 12:34:53.501620","src_mac":"30:89:4a:d4:25:ce","dst_mac":"b0:76:1b:21:30:ab","src_ip":"10.199.217.176","src_location":"内网","src_port":80,"dst_ip":"123.56.161.176","dst_location":"中国-北京-北京市","dst_port":0,"protocol":"TCP","info":"36672 → 80 [SYN] Seq=0 Win=65535 Len=0 MSS=1460 WS=256 SACK_PERM","file_offset":2179,"cap_len":66,"len":66}
2025-02-23 20:47:09.577 (   0.668s) [main thread     ]      tsharkManager.cpp:180   INFO| Packet Hex Data: 
2025-02-23 20:47:09.584 (   0.675s) [main thread     ]      tsharkManager.cpp:176   INFO| {"frame_number":11,"timestamp":"2025-02-22 12:34:53.497669","src_mac":"b0:76:1b:21:30:ab","dst_mac":"30:89:4a:d4:25:ce","src_ip":"114.114.114.114","src_location":"中国-江苏省-南京市","src_port":56718,"dst_ip":"10.199.217.176","dst_location":"内网","dst_port":0,"protocol":"DNS","info":"Standard query response 0xba3d A api.pdfxd.com A 123.56.161.176","file_offset":2074,"cap_len":89,"len":89}
2025-02-23 20:47:09.601 (   0.693s) [main thread     ]      tsharkManager.cpp:180   INFO| Packet Hex Data: 
2025-02-23 20:47:09.610 (   0.701s) [main thread     ]      tsharkManager.cpp:176   INFO| {"frame_number":10,"timestamp":"2025-02-22 12:34:53.477857","src_mac":"30:89:4a:d4:25:ce","dst_mac":"b0:76:1b:21:30:ab","src_ip":"10.199.217.176","src_location":"内网","src_port":53,"dst_ip":"114.114.114.114","dst_location":"中国-江苏省-南京市","dst_port":0,"protocol":"DNS","info":"Standard query 0xba3d A api.pdfxd.com","file_offset":1985,"cap_len":73,"len":73}
2025-02-23 20:47:09.620 (   0.711s) [main thread     ]      tsharkManager.cpp:180   INFO| Packet Hex Data: 
2025-02-23 20:47:09.627 (   0.718s) [main thread     ]      tsharkManager.cpp:176   INFO| {"frame_number":9,"timestamp":"2025-02-22 12:34:53.422618","src_mac":"b0:76:1b:21:30:ab","dst_mac":"30:89:4a:d4:25:ce","src_ip":"20.189.173.8","src_location":"美国-加利福尼亚-圣何塞","src_port":36641,"dst_ip":"10.199.217.176","dst_location":"内网","dst_port":0,"protocol":"TCP","info":"443 → 36641 [ACK] Seq=100 Ack=972 Win=16381 Len=0","file_offset":1909,"cap_len":60,"len":60}
2025-02-23 20:47:09.636 (   0.728s) [main thread     ]      tsharkManager.cpp:180   INFO| Packet Hex Data: 
2025-02-23 20:47:09.642 (   0.734s) [main thread     ]      tsharkManager.cpp:176   INFO| {"frame_number":8,"timestamp":"2025-02-22 12:34:53.369397","src_mac":"30:89:4a:d4:25:ce","dst_mac":"b0:76:1b:21:30:ab","src_ip":"10.199.217.176","src_location":"内网","src_port":8080,"dst_ip":"157.148.54.28","dst_location":"中国-广东省-广州市","dst_port":0,"protocol":"TCP","info":"56769 → 8080 [ACK] Seq=154 Ack=81 Win=515 Len=0","file_offset":1839,"cap_len":54,"len":54}
2025-02-23 20:47:09.651 (   0.743s) [main thread     ]      tsharkManager.cpp:180   INFO| Packet Hex Data: 
2025-02-23 20:47:09.658 (   0.749s) [main thread     ]      tsharkManager.cpp:176   INFO| {"frame_number":7,"timestamp":"2025-02-22 12:34:53.322117","src_mac":"b0:76:1b:21:30:ab","dst_mac":"30:89:4a:d4:25:ce","src_ip":"157.148.54.28","src_location":"中国-广东省-广州市","src_port":56769,"dst_ip":"10.199.217.176","dst_location":"内网","dst_port":0,"protocol":"TCP","info":"8080 → 56769 [PSH, ACK] Seq=1 Ack=154 Win=4098 Len=80","file_offset":1689,"cap_len":134,"len":134}
2025-02-23 20:47:09.668 (   0.759s) [main thread     ]      tsharkManager.cpp:180   INFO| Packet Hex Data: 
2025-02-23 20:47:09.679 (   0.770s) [main thread     ]      tsharkManager.cpp:176   INFO| {"frame_number":6,"timestamp":"2025-02-22 12:34:53.274350","src_mac":"30:89:4a:d4:25:ce","dst_mac":"b0:76:1b:21:30:ab","src_ip":"10.199.217.176","src_location":"内网","src_port":8080,"dst_ip":"157.148.54.28","dst_location":"中国-广东省-广州市","dst_port":0,"protocol":"TCP","info":"56769 → 8080 [PSH, ACK] Seq=1 Ack=1 Win=515 Len=153","file_offset":1466,"cap_len":207,"len":207}
2025-02-23 20:47:09.687 (   0.779s) [main thread     ]      tsharkManager.cpp:180   INFO| Packet Hex Data: 
2025-02-23 20:47:09.701 (   0.793s) [main thread     ]      tsharkManager.cpp:176   INFO| {"frame_number":5,"timestamp":"2025-02-22 12:34:53.154173","src_mac":"30:89:4a:d4:25:ce","dst_mac":"b0:76:1b:21:30:ab","src_ip":"10.199.217.176","src_location":"内网","src_port":443,"dst_ip":"20.189.173.8","dst_location":"美国-加利福尼亚-圣何塞","dst_port":0,"protocol":"TLSv1.2","info":"Application Data","file_offset":1361,"cap_len":89,"len":89}
2025-02-23 20:47:09.713 (   0.805s) [main thread     ]      tsharkManager.cpp:180   INFO| Packet Hex Data: 
2025-02-23 20:47:09.724 (   0.816s) [main thread     ]      tsharkManager.cpp:176   INFO| {"frame_number":4,"timestamp":"2025-02-22 12:34:53.152758","src_mac":"b0:76:1b:21:30:ab","dst_mac":"30:89:4a:d4:25:ce","src_ip":"20.189.173.8","src_location":"美国-加利福尼亚-圣何塞","src_port":36641,"dst_ip":"10.199.217.176","dst_location":"内网","dst_port":0,"protocol":"TLSv1.2","info":"Application Data","file_offset":1192,"cap_len":153,"len":153}
2025-02-23 20:47:09.738 (   0.829s) [main thread     ]      tsharkManager.cpp:180   INFO| Packet Hex Data: 
2025-02-23 20:47:09.751 (   0.842s) [main thread     ]      tsharkManager.cpp:176   INFO| {"frame_number":3,"timestamp":"2025-02-22 12:34:53.152758","src_mac":"b0:76:1b:21:30:ab","dst_mac":"30:89:4a:d4:25:ce","src_ip":"20.189.173.8","src_location":"美国-加利福尼亚-圣何塞","src_port":36641,"dst_ip":"10.199.217.176","dst_location":"内网","dst_port":0,"protocol":"TCP","info":"443 → 36641 [ACK] Seq=1 Ack=937 Win=16381 Len=0","file_offset":1116,"cap_len":60,"len":60}
2025-02-23 20:47:09.760 (   0.852s) [main thread     ]      tsharkManager.cpp:180   INFO| Packet Hex Data: 
2025-02-23 20:47:09.766 (   0.857s) [main thread     ]      tsharkManager.cpp:176   INFO| {"frame_number":2,"timestamp":"2025-02-22 12:34:52.899472","src_mac":"30:89:4a:d4:25:ce","dst_mac":"b0:76:1b:21:30:ab","src_ip":"10.199.217.176","src_location":"内网","src_port":443,"dst_ip":"20.189.173.8","dst_location":"美国-加利福尼亚-圣何塞","dst_port":0,"protocol":"TLSv1.2","info":"Application Data","file_offset":194,"cap_len":906,"len":906}
2025-02-23 20:47:09.775 (   0.866s) [main thread     ]      tsharkManager.cpp:180   INFO| Packet Hex Data: 
2025-02-23 20:47:09.828 (   0.920s) [main thread     ]      tsharkManager.cpp:176   INFO| {"frame_number":1,"timestamp":"2025-02-22 12:34:52.899381","src_mac":"30:89:4a:d4:25:ce","dst_mac":"b0:76:1b:21:30:ab","src_ip":"10.199.217.176","src_location":"内网","src_port":443,"dst_ip":"20.189.173.8","dst_location":"美国-加利福尼亚-圣何塞","dst_port":0,"protocol":"TLSv1.2","info":"Application Data","file_offset":40,"cap_len":138,"len":138}
2025-02-23 20:47:09.838 (   0.929s) [main thread     ]      tsharkManager.cpp:180   INFO| Packet Hex Data: 
2025-02-23 20:47:09.849 (   0.941s) [main thread     ]      tsharkManager.cpp:176   INFO| {"frame_number":14,"timestamp":"2025-02-22 12:34:53.530627","src_mac":"b0:76:1b:21:30:ab","dst_mac":"30:89:4a:d4:25:ce","src_ip":"123.56.161.176","src_location":"中国-北京-北京市","src_port":36672,"dst_ip":"10.199.217.176","dst_location":"内网","dst_port":0,"protocol":"TCP","info":"80 → 36672 [SYN, ACK] Seq=0 Ack=1 Win=29200 Len=0 MSS=1440 SACK_PERM WS=512","file_offset":2343,"cap_len":66,"len":66}
2025-02-23 20:47:09.860 (   0.951s) [main thread     ]      tsharkManager.cpp:180   INFO| Packet Hex Data: 
2025-02-23 20:47:09.866 (   0.958s) [main thread     ]      tsharkManager.cpp:176   INFO| {"frame_number":15,"timestamp":"2025-02-22 12:34:53.530716","src_mac":"30:89:4a:d4:25:ce","dst_mac":"b0:76:1b:21:30:ab","src_ip":"10.199.217.176","src_location":"内网","src_port":80,"dst_ip":"123.56.161.176","dst_location":"中国-北京-北京市","dst_port":0,"protocol":"TCP","info":"36672 → 80 [ACK] Seq=1 Ack=1 Win=262144 Len=0","file_offset":2425,"cap_len":54,"len":54}
2025-02-23 20:47:09.876 (   0.968s) [main thread     ]      tsharkManager.cpp:180   INFO| Packet Hex Data: 
2025-02-23 20:47:09.882 (   0.973s) [main thread     ]      tsharkManager.cpp:176   INFO| {"frame_number":16,"timestamp":"2025-02-22 12:34:53.530822","src_mac":"30:89:4a:d4:25:ce","dst_mac":"b0:76:1b:21:30:ab","src_ip":"10.199.217.176","src_location":"内网","src_port":80,"dst_ip":"123.56.161.176","dst_location":"中国-北京-北京市","dst_port":0,"protocol":"HTTP/JSON","info":"POST /pdf-service/v1/report HTTP/1.1 , JSON (application/json)","file_offset":2495,"cap_len":619,"len":619}
2025-02-23 20:47:09.891 (   0.982s) [main thread     ]      tsharkManager.cpp:180   INFO| Packet Hex Data: 
2025-02-23 20:47:09.924 (   1.015s) [main thread     ]      tsharkManager.cpp:176   INFO| {"frame_number":17,"timestamp":"2025-02-22 12:34:53.554641","src_mac":"b0:76:1b:21:30:ab","dst_mac":"30:89:4a:d4:25:ce","src_ip":"123.56.161.176","src_location":"中国-北京-北京市","src_port":36673,"dst_ip":"10.199.217.176","dst_location":"内网","dst_port":0,"protocol":"TCP","info":"80 → 36673 [SYN, ACK] Seq=0 Ack=1 Win=29200 Len=0 MSS=1440 SACK_PERM WS=512","file_offset":3130,"cap_len":66,"len":66}
2025-02-23 20:47:09.932 (   1.024s) [main thread     ]      tsharkManager.cpp:180   INFO| Packet Hex Data: 
2025-02-23 20:47:09.938 (   1.030s) [main thread     ]      tsharkManager.cpp:176   INFO| {"frame_number":18,"timestamp":"2025-02-22 12:34:53.554723","src_mac":"30:89:4a:d4:25:ce","dst_mac":"b0:76:1b:21:30:ab","src_ip":"10.199.217.176","src_location":"内网","src_port":80,"dst_ip":"123.56.161.176","dst_location":"中国-北京-北京市","dst_port":0,"protocol":"TCP","info":"36673 → 80 [ACK] Seq=1 Ack=1 Win=262144 Len=0","file_offset":3212,"cap_len":54,"len":54}
2025-02-23 20:47:09.947 (   1.038s) [main thread     ]      tsharkManager.cpp:180   INFO| Packet Hex Data: 
2025-02-23 20:47:09.951 (   1.043s) [main thread     ]      tsharkManager.cpp:176   INFO| {"frame_number":19,"timestamp":"2025-02-22 12:34:53.554904","src_mac":"30:89:4a:d4:25:ce","dst_mac":"b0:76:1b:21:30:ab","src_ip":"10.199.217.176","src_location":"内网","src_port":80,"dst_ip":"123.56.161.176","dst_location":"中国-北京-北京市","dst_port":0,"protocol":"HTTP/JSON","info":"POST /pdf-service/v1/report HTTP/1.1 , JSON (application/json)","file_offset":3282,"cap_len":613,"len":613}
2025-02-23 20:47:09.960 (   1.052s) [main thread     ]      tsharkManager.cpp:180   INFO| Packet Hex Data: 
2025-02-23 20:47:09.993 (   1.085s) [main thread     ]      tsharkManager.cpp:176   INFO| {"frame_number":20,"timestamp":"2025-02-22 12:34:53.556484","src_mac":"b0:76:1b:21:30:ab","dst_mac":"30:89:4a:d4:25:ce","src_ip":"123.56.161.176","src_location":"中国-北京-北京市","src_port":36672,"dst_ip":"10.199.217.176","dst_location":"内网","dst_port":0,"protocol":"TCP","info":"80 → 36672 [ACK] Seq=1 Ack=566 Win=30720 Len=0","file_offset":3911,"cap_len":60,"len":60}
2025-02-23 20:47:10.002 (   1.093s) [main thread     ]      tsharkManager.cpp:180   INFO| Packet Hex Data: 
2025-02-23 20:47:10.008 (   1.099s) [main thread     ]      tsharkManager.cpp:176   INFO| {"frame_number":21,"timestamp":"2025-02-22 12:34:53.561487","src_mac":"b0:76:1b:21:30:ab","dst_mac":"30:89:4a:d4:25:ce","src_ip":"123.56.161.176","src_location":"中国-北京-北京市","src_port":36672,"dst_ip":"10.199.217.176","dst_location":"内网","dst_port":0,"protocol":"HTTP/JSON","info":"HTTP/1.1 200 OK , JSON (application/json)","file_offset":3987,"cap_len":215,"len":215}
2025-02-23 20:47:10.016 (   1.108s) [main thread     ]      tsharkManager.cpp:180   INFO| Packet Hex Data: 
2025-02-23 20:47:10.032 (   1.123s) [main thread     ]      tsharkManager.cpp:176   INFO| {"frame_number":22,"timestamp":"2025-02-22 12:34:53.561554","src_mac":"30:89:4a:d4:25:ce","dst_mac":"b0:76:1b:21:30:ab","src_ip":"10.199.217.176","src_location":"内网","src_port":80,"dst_ip":"123.56.161.176","dst_location":"中国-北京-北京市","dst_port":0,"protocol":"TCP","info":"36672 → 80 [ACK] Seq=566 Ack=162 Win=261888 Len=0","file_offset":4218,"cap_len":54,"len":54}
2025-02-23 20:47:10.043 (   1.134s) [main thread     ]      tsharkManager.cpp:180   INFO| Packet Hex Data: 
2025-02-23 20:47:10.050 (   1.141s) [main thread     ]      tsharkManager.cpp:176   INFO| {"frame_number":23,"timestamp":"2025-02-22 12:34:53.564882","src_mac":"30:89:4a:d4:25:ce","dst_mac":"b0:76:1b:21:30:ab","src_ip":"10.199.217.176","src_location":"内网","src_port":80,"dst_ip":"123.56.161.176","dst_location":"中国-北京-北京市","dst_port":0,"protocol":"TCP","info":"36672 → 80 [RST, ACK] Seq=566 Ack=162 Win=0 Len=0","file_offset":4288,"cap_len":54,"len":54}
2025-02-23 20:47:10.058 (   1.149s) [main thread     ]      tsharkManager.cpp:180   INFO| Packet Hex Data: 
2025-02-23 20:47:10.064 (   1.155s) [main thread     ]      tsharkManager.cpp:176   INFO| {"frame_number":24,"timestamp":"2025-02-22 12:34:53.592374","src_mac":"b0:76:1b:21:30:ab","dst_mac":"30:89:4a:d4:25:ce","src_ip":"123.56.161.176","src_location":"中国-北京-北京市","src_port":36672,"dst_ip":"10.199.217.176","dst_location":"内网","dst_port":0,"protocol":"TCP","info":"80 → 36672 [RST] Seq=162 Win=0 Len=0","file_offset":4358,"cap_len":60,"len":60}
2025-02-23 20:47:10.078 (   1.170s) [main thread     ]      tsharkManager.cpp:180   INFO| Packet Hex Data: 
2025-02-23 20:47:10.085 (   1.176s) [main thread     ]      tsharkManager.cpp:176   INFO| {"frame_number":25,"timestamp":"2025-02-22 12:34:53.594427","src_mac":"b0:76:1b:21:30:ab","dst_mac":"30:89:4a:d4:25:ce","src_ip":"123.56.161.176","src_location":"中国-北京-北京市","src_port":36673,"dst_ip":"10.199.217.176","dst_location":"内网","dst_port":0,"protocol":"TCP","info":"80 → 36673 [ACK] Seq=1 Ack=560 Win=30720 Len=0","file_offset":4434,"cap_len":60,"len":60}
2025-02-23 20:47:10.094 (   1.185s) [main thread     ]      tsharkManager.cpp:180   INFO| Packet Hex Data: 
2025-02-23 20:47:10.100 (   1.191s) [main thread     ]      tsharkManager.cpp:176   INFO| {"frame_number":26,"timestamp":"2025-02-22 12:34:53.599127","src_mac":"b0:76:1b:21:30:ab","dst_mac":"30:89:4a:d4:25:ce","src_ip":"123.56.161.176","src_location":"中国-北京-北京市","src_port":36673,"dst_ip":"10.199.217.176","dst_location":"内网","dst_port":0,"protocol":"HTTP/JSON","info":"HTTP/1.1 200 OK , JSON (application/json)","file_offset":4510,"cap_len":215,"len":215}
2025-02-23 20:47:10.111 (   1.202s) [main thread     ]      tsharkManager.cpp:180   INFO| Packet Hex Data: 
2025-02-23 20:47:10.127 (   1.218s) [main thread     ]      tsharkManager.cpp:176   INFO| {"frame_number":27,"timestamp":"2025-02-22 12:34:53.599172","src_mac":"30:89:4a:d4:25:ce","dst_mac":"b0:76:1b:21:30:ab","src_ip":"10.199.217.176","src_location":"内网","src_port":80,"dst_ip":"123.56.161.176","dst_location":"中国-北京-北京市","dst_port":0,"protocol":"TCP","info":"36673 → 80 [ACK] Seq=560 Ack=162 Win=261888 Len=0","file_offset":4741,"cap_len":54,"len":54}
2025-02-23 20:47:10.136 (   1.227s) [main thread     ]      tsharkManager.cpp:180   INFO| Packet Hex Data: 
2025-02-23 20:47:10.142 (   1.233s) [main thread     ]      tsharkManager.cpp:176   INFO| {"frame_number":28,"timestamp":"2025-02-22 12:34:53.605450","src_mac":"30:89:4a:d4:25:ce","dst_mac":"b0:76:1b:21:30:ab","src_ip":"10.199.217.176","src_location":"内网","src_port":80,"dst_ip":"123.56.161.176","dst_location":"中国-北京-北京市","dst_port":0,"protocol":"TCP","info":"36673 → 80 [RST, ACK] Seq=560 Ack=162 Win=0 Len=0","file_offset":4811,"cap_len":54,"len":54}
2025-02-23 20:47:10.151 (   1.243s) [main thread     ]      tsharkManager.cpp:180   INFO| Packet Hex Data: 
2025-02-23 20:47:10.158 (   1.249s) [main thread     ]      tsharkManager.cpp:176   INFO| {"frame_number":29,"timestamp":"2025-02-22 12:34:54.720955","src_mac":"b0:76:1b:21:30:ab","dst_mac":"30:89:4a:d4:25:ce","src_ip":"","src_location":"","src_port":0,"dst_ip":"","dst_location":"","dst_port":0,"protocol":"ARP","info":"Who has 10.199.217.176? Tell 10.199.255.254","file_offset":4881,"cap_len":56,"len":56}
2025-02-23 20:47:10.165 (   1.257s) [main thread     ]      tsharkManager.cpp:180   INFO| Packet Hex Data: 
2025-02-23 20:47:10.171 (   1.262s) [main thread     ]      tsharkManager.cpp:186   INFO| 30 packets have been printed.
2025-02-23 20:47:10.173 (   1.265s) [main thread     ]             loguru.cpp:548   INFO| atexit
